Sheet: teste_indices_res134
A1: COMPETENCIA | B1: INDICE_CALCULADO | C1: INDICE_GOOGLE | D1: ACUMULADO_CALCULADO | E1: ACUMULADO_GOOGLE
A2: 01/10/1964 | B2: 1 | C2: 1 | D2: 0.00559123610683 | E2: 0.0055912356 | F2: of:=[.B2]-[.C2] -> 0 | G2: of:=[.D2]-[.E2] -> 0.00000000050682999984
A3: 01/11/1964 | B3: 1 | C3: 1 | D3: 0.00559123610683 | E3: 0.0055912356 | F3: of:=[.B3]-[.C3] -> 0 | G3: of:=[.D3]-[.E3] -> 0.00000000050682999984
A4: 01/12/1964 | B4: 1.13 | C4: 1.13 | D4: 0.00559123610683 | E4: 0.0055912356 | F4: of:=[.B4]-[.C4] -> 0 | G4: of:=[.D4]-[.E4] -> 0.00000000050682999984
A5: 01/01/1965 | B5: 1 | C5: 1 | D5: 0.00494799655472 | E5: 0.0049479961 | F5: of:=[.B5]-[.C5] -> 0 | G5: of:=[.D5]-[.E5] -> 0.0000000004547199995
A6: 01/02/1965 | B6: 1 | C6: 1 | D6: 0.00494799655472 | E6: 0.0049479961 | F6: of:=[.B6]-[.C6] -> 0 | G6: of:=[.D6]-[.E6] -> 0.0000000004547199995
A7: 01/03/1965 | B7: 1.185840708 | C7: 1.185840708 | D7: 0.00494799655472 | E7: 0.0049479961 | F7: of:=[.B7]-[.C7] -> 0 | G7: of:=[.D7]-[.E7] -> 0.0000000004547199995
A8: 01/04/1965 | B8: 1 | C8: 1 | D8: 0.0041725642587 | E8: 0.0041725639 | F8: of:=[.B8]-[.C8] -> 0 | G8: of:=[.D8]-[.E8] -> 0.00000000035870000026
A9: 01/05/1965 | B9: 1 | C9: 1 | D9: 0.0041725642587 | E9: 0.0041725639 | F9: of:=[.B9]-[.C9] -> 0 | G9: of:=[.D9]-[.E9] -> 0.00000000035870000026
A10: 01/06/1965 | B10: 1.1343283582 | C10: 1.1343283582 | D10: 0.0041725642587 | E10: 0.0041725639 | F10: of:=[.B10]-[.C10] -> 0 | G10: of:=[.D10]-[.E10] -> 0.00000000035870000026
A11: 01/07/1965 | B11: 1 | C11: 1 | D11: 0.00367844480704 | E11: 0.0036784445 | F11: of:=[.B11]-[.C11] -> 0 | G11: of:=[.D11]-[.E11] -> 0.00000000030703999976
A12: 01/08/1965 | B12: 1.0328947368 | C12: 1.0328947368 | D12: 0.00367844480704 | E12: 0.0036784445 | F12: of:=[.B12]-[.C12] -> 0 | G12: of:=[.D12]-[.E12] -> 0.00000000030703999976
A13: 01/09/1965 | B13: 1.0127388535 | C13: 1.0127388535 | D13: 0.0035612968834 | E13: 0.0035612966 | F13: of:=[.B13]-[.C13] -> 0 | G13: of:=[.D13]-[.E13] -> 0.00000000028340000008
A14: 01/10/1965 | B14: 1.0094339623 | C14: 1.0094339623 | D14: 0.0035165006962 | E14: 0.0035165004 | F14: of:=[.B14]-[.C14] -> 0 | G14: of:=[.D14]-[.E14] -> 0.00000000029620000029
A15: 01/11/1965 | B15: 1.015576324 | C15: 1.015576324 | D15: 0.00348363620358 | E15: 0.0034836359 | F15: of:=[.B15]-[.C15] -> 0 | G15: of:=[.D15]-[.E15] -> 0.00000000030358000011
A16: 01/12/1965 | B16: 1.018404908 | C16: 1.018404908 | D16: 0.00343020620042 | E16: 0.0034302059 | F16: of:=[.B16]-[.C16] -> 0 | G16: of:=[.D16]-[.E16] -> 0.00000000030042000007
A17: 01/01/1966 | B17: 1.0271084337 | C17: 1.0271084337 | D17: 0.00336821452202 | E17: 0.0033682142 | F17: of:=[.B17]-[.C17] -> 0 | G17: of:=[.D17]-[.E17] -> 0.00000000032202000008
A18: 01/02/1966 | B18: 1.0146627566 | C18: 1.0146627566 | D18: 0.00327931736466 | E18: 0.0032793171 | F18: of:=[.B18]-[.C18] -> 0 | G18: of:=[.D18]-[.E18] -> 0.00000000026466000008
A19: 01/03/1966 | B19: 1.0173410405 | C19: 1.0173410405 | D19: 0.00323192838539 | E19: 0.0032319281 | F19: of:=[.B19]-[.C19] -> 0 | G19: of:=[.D19]-[.E19] -> 0.00000000028539000026
A20: 01/04/1966 | B20: 1.0386363636 | C20: 1.0386363636 | D20: 0.00317683869689 | E20: 0.0031768384 | F20: of:=[.B20]-[.C20] -> 0 | G20: of:=[.D20]-[.E20] -> 0.00000000029689
A21: 01/05/1966 | B21: 1.0443107221 | C21: 1.0443107221 | D21: 0.00305866307807 | E21: 0.0030586628 | F21: of:=[.B21]-[.C21] -> 0 | G21: of:=[.D21]-[.E21] -> 0.00000000027807000019
A22: 01/06/1966 | B22: 1.0408590885 | C22: 1.0408590885 | D22: 0.00292888219315 | E22: 0.0029288819 | F22: of:=[.B22]-[.C22] -> 0 | G22: of:=[.D22]-[.E22] -> 0.00000000029315000037
A23: 01/07/1966 | B23: 1.0281831907 | C23: 1.0281831907 | D23: 0.00281390845842 | E23: 0.0028139082 | F23: of:=[.B23]-[.C23] -> 0 | G23: of:=[.D23]-[.E23] -> 0.00000000025841999981
A24: 01/08/1966 | B24: 1.0283896231 | C24: 1.0283896231 | D24: 0.00273677734072 | E24: 0.0027367771 | F24: of:=[.B24]-[.C24] -> 0 | G24: of:=[.D24]-[.E24] -> 0.00000000024071999992
A25: 01/09/1966 | B25: 1.0285578296 | C25: 1.0285578296 | D25: 0.0026612261338 | E25: 0.0026612259 | F25: of:=[.B25]-[.C25] -> 0 | G25: of:=[.D25]-[.E25] -> 0.00000000023380000019
A26: 01/10/1966 | B26: 1.0263766775 | C26: 1.0263766775 | D26: 0.0025873373934 | E26: 0.0025873372 | F26: of:=[.B26]-[.C26] -> 0 | G26: of:=[.D26]-[.E26] -> 0.00000000019340000001
A27: 01/11/1966 | B27: 1.022993688 | C27: 1.022993688 | D27: 0.00252084585525 | E27: 0.0025208456 | F27: of:=[.B27]-[.C27] -> 0 | G27: of:=[.D27]-[.E27] -> 0.00000000025524999996
A28: 01/12/1966 | B28: 1.0237990304 | C28: 1.0237990304 | D28: 0.00246418515072 | E28: 0.0024641849 | F28: of:=[.B28]-[.C28] -> 0 | G28: of:=[.D28]-[.E28] -> 0.00000000025071999988
A29: 01/01/1967 | B29: 0.0010236763 | C29: 0.0010236763 | D29: 0.00240690318856 | E29: 0.002406903 | F29: of:=[.B29]-[.C29] -> 0 | G29: of:=[.D29]-[.E29] -> 0.00000000018855999965
A30: 01/02/1967 | B30: 1.0210260723 | C30: 1.0210260723 | D30: 2.35123465158229 | E30: 2.3512344947 | F30: of:=[.B30]-[.C30] -> 0 | G30: of:=[.D30]-[.E30] -> 0.00000015688229026978
A31: 01/03/1967 | B31: 1.0148270181 | C31: 1.0148270181 | D31: 2.30281548666609 | E31: 2.3028153329 | F31: of:=[.B31]-[.C31] -> 0 | G31: of:=[.D31]-[.E31] -> 0.000000153766090083
A32: 01/04/1967 | B32: 1.0150162338 | C32: 1.0150162338 | D32: 2.26917045525405 | E32: 2.2691703037 | F32: of:=[.B32]-[.C32] -> 0 | G32: of:=[.D32]-[.E32] -> 0.00000015155404975431
A33: 01/05/1967 | B33: 1.0179928029 | C33: 1.0179928029 | D33: 2.23560016055977 | E33: 2.2356000113 | F33: of:=[.B33]-[.C33] -> 0 | G33: of:=[.D33]-[.E33] -> 0.00000014925977032121
A34: 01/06/1967 | B34: 1.0282796544 | C34: 1.0282796544 | D34: 2.19608641062207 | E34: 2.1960862641 | F34: of:=[.B34]-[.C34] -> 0 | G34: of:=[.D34]-[.E34] -> 0.00000014652207003252
A35: 01/07/1967 | B35: 1.025210084 | C35: 1.025210084 | D35: 2.13568984004015 | E35: 2.1356896976 | F35: of:=[.B35]-[.C35] -> 0 | G35: of:=[.D35]-[.E35] -> 0.00000014244014989728
A36: 01/08/1967 | B36: 1.0152757079 | C36: 1.0152757079 | D36: 2.08317287682877 | E36: 2.0831727378 | F36: of:=[.B36]-[.C36] -> 0 | G36: of:=[.D36]-[.E36] -> 0.00000013902876982996
A37: 01/09/1967 | B37: 1.0047706422 | C37: 1.0047706422 | D37: 2.05182972528478 | E37: 2.0518295884 | F37: of:=[.B37]-[.C37] -> 0 | G37: of:=[.D37]-[.E37] -> 0.00000013688477995544
A38: 01/10/1967 | B38: 1.0069393718 | C38: 1.0069393718 | D38: 2.04208765573822 | E38: 2.0420875195 | F38: of:=[.B38]-[.C38] -> 0 | G38: of:=[.D38]-[.E38] -> 0.00000013623822026077
A39: 01/11/1967 | B39: 1.0141458107 | C39: 1.0141458107 | D39: 2.02801450904417 | E39: 2.0280143737 | F39: of:=[.B39]-[.C39] -> 0 | G39: of:=[.D39]-[.E39] -> 0.00000013534417009353
A40: 01/12/1967 | B40: 1.0185979971 | C40: 1.0185979971 | D40: 1.99972675294528 | E40: 1.9997266196 | F40: of:=[.B40]-[.C40] -> 0 | G40: of:=[.D40]-[.E40] -> 0.00000013334527992903
A41: 01/01/1968 | B41: 1.0175561798 | C41: 1.0175561798 | D41: 1.96321488814881 | E41: 1.9632147571 | F41: of:=[.B41]-[.C41] -> 0 | G41: of:=[.D41]-[.E41] -> 0.0000001310488100259
A42: 01/02/1968 | B42: 1.0144927536 | C42: 1.0144927536 | D42: 1.9293429956218 | E42: 1.9293428669 | F42: of:=[.B42]-[.C42] -> 0 | G42: of:=[.D42]-[.E42] -> 0.00000012872180010781
A43: 01/03/1968 | B43: 1.0146258503 | C43: 1.0146258503 | D43: 1.90178095287068 | E43: 1.901780826 | F43: of:=[.B43]-[.C43] -> 0 | G43: of:=[.D43]-[.E43] -> 0.00000012687067996176
A44: 01/04/1968 | B44: 1.0187730473 | C44: 1.0187730473 | D44: 1.87436674544451 | E44: 1.8743666203 | F44: of:=[.B44]-[.C44] -> 0 | G44: of:=[.D44]-[.E44] -> 0.00000012514451008805
A45: 01/05/1968 | B45: 1.0266535044 | C45: 1.0266535044 | D45: 1.83982757534864 | E45: 1.8398274526 | F45: of:=[.B45]-[.C45] -> 0 | G45: of:=[.D45]-[.E45] -> 0.00000012274863991912
A46: 01/06/1968 | B46: 1.028525641 | C46: 1.028525641 | D46: 1.79206282106238 | E46: 1.7920627014 | F46: of:=[.B46]-[.C46] -> 0 | G46: of:=[.D46]-[.E46] -> 0.00000011966238000483
A47: 01/07/1968 | B47: 1.0224368962 | C47: 1.0224368962 | D47: 1.74236086065878 | E47: 1.7423607443 | F47: of:=[.B47]-[.C47] -> 0 | G47: of:=[.D47]-[.E47] -> 0.00000011635877994465
A48: 01/08/1968 | B48: 1.0182871076 | C48: 1.0182871076 | D48: 1.70412557208611 | E48: 1.7041254582 | F48: of:=[.B48]-[.C48] -> 0 | G48: of:=[.D48]-[.E48] -> 0.00000011388610987595
A49: 01/09/1968 | B49: 1.0140676444 | C49: 1.0140676444 | D49: 1.67352170067494 | E49: 1.6735215888 | F49: of:=[.B49]-[.C49] -> 0 | G49: of:=[.D49]-[.E49] -> 0.00000011187494020071
A50: 01/10/1968 | B50: 1.0150531287 | C50: 1.0150531287 | D50: 1.65030578573002 | E50: 1.6503056754 | F50: of:=[.B50]-[.C50] -> 0 | G50: of:=[.D50]-[.E50] -> 0.00000011033002000893
A51: 01/11/1968 | B51: 1.0162838034 | C51: 1.0162838034 | D51: 1.62583192846625 | E51: 1.6258318198 | F51: of:=[.B51]-[.C51] -> 0 | G51: of:=[.D51]-[.E51] -> 0.00000010866624999828
A52: 01/12/1968 | B52: 1.0191702432 | C52: 1.0191702432 | D52: 1.59978140262296 | E52: 1.5997812957 | F52: of:=[.B52]-[.C52] -> 0 | G52: of:=[.D52]-[.E52] -> 0.00000010692296004145
A53: 01/01/1969 | B53: 1.0182481752 | C53: 1.0182481752 | D53: 1.56969006237854 | E53: 1.5696899574 | F53: of:=[.B53]-[.C53] -> 0 | G53: of:=[.D53]-[.E53] -> 0.00000010497853986102
A54: 01/02/1969 | B54: 1.017645437 | C54: 1.017645437 | D54: 1.54155941607284 | E54: 1.541559313 | F54: of:=[.B54]-[.C54] -> 0 | G54: of:=[.D54]-[.E54] -> 0.00000010307284004085
A55: 01/03/1969 | B55: 1.0140883229 | C55: 1.0140883229 | D55: 1.51482958604652 | E55: 1.5148294848 | F55: of:=[.B55]-[.C55] -> 0 | G55: of:=[.D55]-[.E55] -> 0.00000010124652005672
A56: 01/04/1969 | B56: 1.0154955918 | C56: 1.0154955918 | D56: 1.49378466533816 | E56: 1.4937845654 | F56: of:=[.B56]-[.C56] -> 0 | G56: of:=[.D56]-[.E56] -> 0.00000009993815996978
A57: 01/05/1969 | B57: 1.0123651671 | C57: 1.0123651671 | D57: 1.47099079247639 | E57: 1.4709906941 | F57: of:=[.B57]-[.C57] -> 0 | G57: of:=[.D57]-[.E57] -> 0.00000009837639014521
A58: 01/06/1969 | B58: 1.0135135135 | C58: 1.0135135135 | D58: 1.45302390904081 | E58: 1.4530238119 | F58: of:=[.B58]-[.C58] -> 0 | G58: of:=[.D58]-[.E58] -> 0.00000009714080984047
A59: 01/07/1969 | B59: 1.0069230769 | C59: 1.0069230769 | D59: 1.43365025693938 | E59: 1.4336501611 | F59: of:=[.B59]-[.C59] -> 0 | G59: of:=[.D59]-[.E59] -> 0.00000009583937998769
A60: 01/08/1969 | B60: 1.0073847721 | C60: 1.0073847721 | D60: 1.42379322693958 | E60: 1.4237931317 | F60: of:=[.B60]-[.C60] -> 0 | G60: of:=[.D60]-[.E60] -> 0.00000009523958000024
A61: 01/09/1969 | B61: 1.0091001011 | C61: 1.0091001011 | D61: 1.41335591560663 | E61: 1.4133558211 | F61: of:=[.B61]-[.C61] -> 0 | G61: of:=[.D61]-[.E61] -> 0.00000009450663007726
A62: 01/10/1969 | B62: 1.0162825651 | C62: 1.0162825651 | D62: 1.4006102209939 | E62: 1.4006101273 | F62: of:=[.B62]-[.C62] -> 0 | G62: of:=[.D62]-[.E62] -> 0.00000009369389997183
A63: 01/11/1969 | B63: 1.020951442 | C63: 1.020951442 | D63: 1.37817007699633 | E63: 1.3781699848 | F63: of:=[.B63]-[.C63] -> 0 | G63: of:=[.D63]-[.E63] -> 0.00000009219633012592
A64: 01/12/1969 | B64: 1.0224529213 | C64: 1.0224529213 | D64: 1.34988797733275 | E64: 1.3498878871 | F64: of:=[.B64]-[.C64] -> 0 | G64: of:=[.D64]-[.E64] -> 0.00000009023274993858
A65: 01/01/1970 | B65: 1.0224321133 | C65: 1.0224321133 | D65: 1.32024462859026 | E65: 1.3202445403 | F65: of:=[.B65]-[.C65] -> 0 | G65: of:=[.D65]-[.E65] -> 0.00000008829025999191
A66: 01/02/1970 | B66: 1.0200923788 | C66: 1.0200923788 | D66: 1.29127852247231 | E66: 1.2912784361 | F66: of:=[.B66]-[.C66] -> 0 | G66: of:=[.D66]-[.E66] -> 0.00000008637230997088
A67: 01/03/1970 | B67: 1.0113199004 | C67: 1.0113199004 | D67: 1.26584469143012 | E67: 1.2658446068 | F67: of:=[.B67]-[.C67] -> 0 | G67: of:=[.D67]-[.E67] -> 0.00000008463012002302
A68: 01/04/1970 | B68: 1.0091784195 | C68: 1.0091784195 | D68: 1.25167584552569 | E68: 1.2516757619 | F68: of:=[.B68]-[.C68] -> 0 | G68: of:=[.D68]-[.E68] -> 0.00000008362568992837
A69: 01/05/1970 | B69: 1.0093167702 | C69: 1.0093167702 | D69: 1.24029192592707 | E69: 1.240291843 | F69: of:=[.B69]-[.C69] -> 0 | G69: of:=[.D69]-[.E69] -> 0.00000008292706987767
A70: 01/06/1970 | B70: 1.0153846154 | C70: 1.0153846154 | D70: 1.22884307736341 | E70: 1.2288429952 | F70: of:=[.B70]-[.C70] -> 0 | G70: of:=[.D70]-[.E70] -> 0.00000008216341007561
A71: 01/07/1970 | B71: 1.0088744589 | C71: 1.0088744589 | D71: 1.21022424283957 | E71: 1.210224162 | F71: of:=[.B71]-[.C71] -> 0 | G71: of:=[.D71]-[.E71] -> 0.00000008083956992699
A72: 01/08/1970 | B72: 1.0094400343 | C72: 1.0094400343 | D72: 1.19957863157633 | E72: 1.1995785515 | F72: of:=[.B72]-[.C72] -> 0 | G72: of:=[.D72]-[.E72] -> 0.00000008007633001128
A73: 01/09/1970 | B73: 1.0119022317 | C73: 1.0119022317 | D73: 1.18836046799766 | E73: 1.1883603886 | F73: of:=[.B73]-[.C73] -> 0 | G73: of:=[.D73]-[.E73] -> 0.0000000793976600022
A74: 01/10/1970 | B74: 1.0189035917 | C74: 1.0189035917 | D74: 1.17438269308015 | E74: 1.1743826146 | F74: of:=[.B74]-[.C74] -> 0 | G74: of:=[.D74]-[.E74] -> 0.00000007848014993428
A75: 01/11/1970 | B75: 1.0212327355 | C75: 1.0212327355 | D75: 1.15259451693633 | E75: 1.15259444 | F75: of:=[.B75]-[.C75] -> 0 | G75: of:=[.D75]-[.E75] -> 0.00000007693632997352
A76: 01/12/1970 | B76: 1.0195801373 | C76: 1.0195801373 | D76: 1.12863060188921 | E76: 1.1286305265 | F76: of:=[.B76]-[.C76] -> 0 | G76: of:=[.D76]-[.E76] -> 0.00000007538920998584
A77: 01/01/1971 | B77: 1.0184121956 | C77: 1.0184121956 | D77: 1.10695624659577 | E77: 1.1069561727 | F77: of:=[.B77]-[.C77] -> 0 | G77: of:=[.D77]-[.E77] -> 0.00000007389577016959
A78: 01/02/1971 | B78: 1.0132192846 | C78: 1.0132192846 | D78: 1.0869432351442 | E78: 1.0869431626 | F78: of:=[.B78]-[.C78] -> 0 | G78: of:=[.D78]-[.E78] -> 0.00000007254420020253
A79: 01/03/1971 | B79: 1.0099769762 | C79: 1.0099769762 | D79: 1.07276208779752 | E79: 1.0727620162 | F79: of:=[.B79]-[.C79] -> 0 | G79: of:=[.D79]-[.E79] -> 0.00000007159751991281
A80: 01/04/1971 | B80: 1.0115881459 | C80: 1.0115881459 | D80: 1.0621648939303 | E80: 1.062164823 | F80: of:=[.B80]-[.C80] -> 0 | G80: of:=[.D80]-[.E80] -> 0.00000007093029985583
A81: 01/05/1971 | B81: 1.0142723005 | C81: 1.0142723005 | D81: 1.04999737119824 | E81: 1.0499973011 | F81: of:=[.B81]-[.C81] -> 0 | G81: of:=[.D81]-[.E81] -> 0.0000000700982401014
A82: 01/06/1971 | B82: 1.0198111461 | C82: 1.0198111461 | D82: 1.03522236649924 | E82: 1.0352222974 | F82: of:=[.B82]-[.C82] -> 0 | G82: of:=[.D82]-[.E82] -> 0.00000006909923988552
A83: 01/07/1971 | B83: 1.0199709513 | C83: 1.0199709513 | D83: 1.01511183757716 | E83: 1.0151117699 | F83: of:=[.B83]-[.C83] -> 0 | G83: of:=[.D83]-[.E83] -> 0.00000006767715987621
A84: 01/08/1971 | B84: 1.021003916 | C84: 1.021003916 | D84: 0.99523602734308 | E84: 0.9952359609 | F84: of:=[.B84]-[.C84] -> 0 | G84: of:=[.D84]-[.E84] -> 0.00000006644308003789
A85: 01/09/1971 | B85: 1.0217921897 | C85: 1.0217921897 | D85: 0.97476220389255 | E85: 0.9747621388 | F85: of:=[.B85]-[.C85] -> 0 | G85: of:=[.D85]-[.E85] -> 0.00000006509255001674
A86: 01/10/1971 | B86: 1.0201330831 | C86: 1.0201330831 | D86: 0.95397304238423 | E86: 0.9539729787 | F86: of:=[.B86]-[.C86] -> 0 | G86: of:=[.D86]-[.E86] -> 0.00000006368423000058
A87: 01/11/1971 | B87: 1.0163907008 | C87: 1.0163907008 | D87: 0.93514567676334 | E87: 0.9351456144 | F87: of:=[.B87]-[.C87] -> 0 | G87: of:=[.D87]-[.E87] -> 0.00000006236334004761
A88: 01/12/1971 | B88: 1.0123416159 | C88: 1.0123416159 | D88: 0.92006516394462 | E88: 0.9200651026 | F88: of:=[.B88]-[.C88] -> 0 | G88: of:=[.D88]-[.E88] -> 0.00000006134462005036
A89: 01/01/1972 | B89: 1.0120286086 | C89: 1.0120286086 | D89: 0.90884850478725 | E89: 0.9088484441 | F89: of:=[.B89]-[.C89] -> 0 | G89: of:=[.D89]-[.E89] -> 0.00000006068725000308
A90: 01/02/1972 | B90: 1.0133311918 | C90: 1.0133311918 | D90: 0.89804625784692 | E90: 0.8980461979 | F90: of:=[.B90]-[.C90] -> 0 | G90: of:=[.D90]-[.E90] -> 0.00000005994692009459
A91: 01/03/1972 | B91: 1.0114122682 | C91: 1.0114122682 | D91: 0.88623173263985 | E91: 0.8862316735 | F91: of:=[.B91]-[.C91] -> 0 | G91: of:=[.D91]-[.E91] -> 0.00000005913985001715
A92: 01/04/1972 | B92: 1.0133207961 | C92: 1.0133207961 | D92: 0.87623193874943 | E92: 0.8762318803 | F92: of:=[.B92]-[.C92] -> 0 | G92: of:=[.D92]-[.E92] -> 0.00000005844942996269
A93: 01/05/1972 | B93: 1.016857408 | C93: 1.016857408 | D93: 0.86471326960013 | E93: 0.8647132119 | F93: of:=[.B93]-[.C93] -> 0 | G93: of:=[.D93]-[.E93] -> 0.00000005770013000728
A94: 01/06/1972 | B94: 1.0179467681 | C94: 1.0179467681 | D94: 0.8503780990305 | E94: 0.8503780423 | F94: of:=[.B94]-[.C94] -> 0 | G94: of:=[.D94]-[.E94] -> 0.00000005673049996435
A95: 01/07/1972 | B95: 1.0143433438 | C95: 1.0143433438 | D95: 0.83538562691027 | E95: 0.8353855712 | F95: of:=[.B95]-[.C95] -> 0 | G95: of:=[.D95]-[.E95] -> 0.00000005571026995277
A96: 01/08/1972 | B96: 1.0083959346 | C96: 1.0083959346 | D96: 0.82357283854271 | E96: 0.8235727837 | F96: of:=[.B96]-[.C96] -> 0 | G96: of:=[.D96]-[.E96] -> 0.00000005484271003997
A97: 01/09/1972 | B97: 1.0071574642 | C97: 1.0071574642 | D97: 0.81671574654791 | E97: 0.8167156921 | F97: of:=[.B97]-[.C97] -> 0 | G97: of:=[.D97]-[.E97] -> 0.00000005444791006948
A98: 01/10/1972 | B98: 1.0095721537 | C98: 1.0095721537 | D98: 0.81091167526285 | E98: 0.8109116212 | F98: of:=[.B98]-[.C98] -> 0 | G98: of:=[.D98]-[.E98] -> 0.00000005406284997456
A99: 01/11/1972 | B99: 1.0066082459 | C99: 1.0066082459 | D99: 0.80322310029147 | E99: 0.8032230467 | F99: of:=[.B99]-[.C99] -> 0 | G99: of:=[.D99]-[.E99] -> 0.00000005359147003947
A100: 01/12/1972 | B100: 1.0114171543 | C100: 1.0114171543 | D100: 0.7979500501442 | E100: 0.7979499969 | F100: of:=[.B100]-[.C100] -> 0 | G100: of:=[.D100]-[.E100] -> 0.00000005324419993791
A101: 01/01/1973 | B101: 1.00987724 | C101: 1.00987724 | D101: 0.78894257107638 | E101: 0.7889425185 | F101: of:=[.B101]-[.C101] -> 0 | G101: of:=[.D101]-[.E101] -> 0.00000005257638002742
A102: 01/02/1973 | B102: 1.0104792511 | C102: 1.0104792511 | D102: 0.78122621228337 | E102: 0.7812261602 | F102: of:=[.B102]-[.C102] -> 0 | G102: of:=[.D102]-[.E102] -> 0.00000005208336995022
A103: 01/03/1973 | B103: 1.0120298673 | C103: 1.0120298673 | D103: 0.77312444707096 | E103: 0.7731243955 | F103: of:=[.B103]-[.C103] -> 0 | G103: of:=[.D103]-[.E103] -> 0.0000000515709599469
A104: 01/04/1973 | B104: 1.0114769777 | C104: 1.0114769777 | D104: 0.76393441740369 | E104: 0.7639343665 | F104: of:=[.B104]-[.C104] -> 0 | G104: of:=[.D104]-[.E104] -> 0.00000005090368992988
A105: 01/05/1973 | B105: 1.012697555 | C105: 1.012697555 | D105: 0.75526624356869 | E105: 0.7552661932 | F105: of:=[.B105]-[.C105] -> 0 | G105: of:=[.D105]-[.E105] -> 0.00000005036868999664
A106: 01/06/1973 | B106: 1.0110710951 | C106: 1.0110710951 | D106: 0.74579645209936 | E106: 0.7457964023 | F106: of:=[.B106]-[.C106] -> 0 | G106: of:=[.D106]-[.E106] -> 0.00000004979935996907
A107: 01/07/1973 | B107: 1.0089709763 | C107: 1.0089709763 | D107: 0.73763007934234 | E107: 0.7376300301 | F107: of:=[.B107]-[.C107] -> 0 | G107: of:=[.D107]-[.E107] -> 0.0000000492423400944
A108: 01/08/1973 | B108: 1.0083682008 | C108: 1.0083682008 | D108: 0.73107165287083 | E108: 0.7310716041 | F108: of:=[.B108]-[.C108] -> 0 | G108: of:=[.D108]-[.E108] -> 0.00000004877082993016
A109: 01/09/1973 | B109: 1.0097251037 | C109: 1.0097251037 | D109: 0.72500466822618 | E109: 0.7250046199 | F109: of:=[.B109]-[.C109] -> 0 | G109: of:=[.D109]-[.E109] -> 0.00000004832618005768
A110: 01/10/1973 | B110: 1.0068062155 | C110: 1.0068062155 | D110: 0.7180218314564 | E110: 0.7180217835 | F110: of:=[.B110]-[.C110] -> 0 | G110: of:=[.D110]-[.E110] -> 0.00000004795639996225
A111: 01/11/1973 | B111: 1.0085459184 | C111: 1.0085459184 | D111: 0.71316785733173 | E111: 0.7131678097 | F111: of:=[.B111]-[.C111] -> 0 | G111: of:=[.D111]-[.E111] -> 0.00000004763173000466
A112: 01/12/1973 | B112: 1.0196028835 | C112: 1.0196028835 | D112: 0.70712482626783 | E112: 0.7071247791 | F112: of:=[.B112]-[.C112] -> 0 | G112: of:=[.D112]-[.E112] -> 0.00000004716782997516
A113: 01/01/1974 | B113: 1.0105432895 | C113: 1.0105432895 | D113: 0.69352964542477 | E113: 0.6935295991 | F113: of:=[.B113]-[.C113] -> 0 | G113: of:=[.D113]-[.E113] -> 0.00000004632477001998
A114: 01/02/1974 | B114: 1.0149748374 | C114: 1.0149748374 | D114: 0.68629385067503 | E114: 0.6862938049 | F114: of:=[.B114]-[.C114] -> 0 | G114: of:=[.D114]-[.E114] -> 0.0000000457750299887
A115: 01/03/1974 | B115: 1.0125770952 | C115: 1.0125770952 | D115: 0.67616833973251 | E115: 0.6761682946 | F115: of:=[.B115]-[.C115] -> 0 | G115: of:=[.D115]-[.E115] -> 0.00000004513250995153
A116: 01/04/1974 | B116: 1.0163621163 | C116: 1.0163621163 | D116: 0.66776973618878 | E116: 0.6677696917 | F116: of:=[.B116]-[.C116] -> 0 | G116: of:=[.D116]-[.E116] -> 0.0000000444887799933
A117: 01/05/1974 | B117: 1.0212690952 | C117: 1.0212690952 | D117: 0.65701950661026 | E117: 0.6570194628 | F117: of:=[.B117]-[.C117] -> 0 | G117: of:=[.D117]-[.E117] -> 0.00000004381025997535
A118: 01/06/1974 | B118: 1.0332527902 | C118: 1.0332527902 | D118: 0.6433363250668 | E118: 0.6433362822 | F118: of:=[.B118]-[.C118] -> 0 | G118: of:=[.D118]-[.E118] -> 0.00000004286679999854
A119: 01/07/1974 | B119: 1.043986637 | C119: 1.043986637 | D119: 0.62263207142394 | E119: 0.6226320299 | F119: of:=[.B119]-[.C119] -> 0 | G119: of:=[.D119]-[.E119] -> 0.00000004152393995316
A120: 01/08/1974 | B120: 1.04768 | C120: 1.04768 | D120: 0.59639850679807 | E120: 0.596398467 | F120: of:=[.B120]-[.C120] -> 0 | G120: of:=[.D120]-[.E120] -> 0.00000003979807006171
A121: 01/09/1974 | B121: 1.037466911 | C121: 1.037466911 | D121: 0.56925636339156 | E121: 0.5692563254 | F121: of:=[.B121]-[.C121] -> 0 | G121: of:=[.D121]-[.E121] -> 0.00000003799156000905
A122: 01/10/1974 | B122: 1.0215897939 | C122: 1.0215897939 | D122: 0.54869833182715 | E122: 0.5486982952 | F122: of:=[.B122]-[.C122] -> 0 | G122: of:=[.D122]-[.E122] -> 0.00000003662714997965
A123: 01/11/1974 | B123: 1.0125840538 | C123: 1.0125840538 | D123: 0.53710240167186 | E123: 0.5371023658 | F123: of:=[.B123]-[.C123] -> 0 | G123: of:=[.D123]-[.E123] -> 0.00000003587185992693
A124: 01/12/1974 | B124: 1.012807134 | C124: 1.012807134 | D124: 0.5304274738045 | E124: 0.5304274384 | F124: of:=[.B124]-[.C124] -> 0 | G124: of:=[.D124]-[.E124] -> 0.00000003540449999839
A125: 01/01/1975 | B125: 1.0151742226 | C125: 1.0151742226 | D125: 0.52372012004855 | E125: 0.5237200851 | F125: of:=[.B125]-[.C125] -> 0 | G125: of:=[.D125]-[.E125] -> 0.0000000349485499429
A126: 01/02/1975 | B126: 1.0166082303 | C126: 1.0166082303 | D126: 0.51589186209558 | E126: 0.5158918277 | F126: of:=[.B126]-[.C126] -> 0 | G126: of:=[.D126]-[.E126] -> 0.00000003439558005081
A127: 01/03/1975 | B127: 1.0187874387 | C127: 1.0187874387 | D127: 0.50746378665786 | E127: 0.5074637528 | F127: of:=[.B127]-[.C127] -> 0 | G127: of:=[.D127]-[.E127] -> 0.00000003385785996013
A128: 01/04/1975 | B128: 1.0199554566 | C128: 1.0199554566 | D128: 0.49810565715788 | E128: 0.4981056239 | F128: of:=[.B128]-[.C128] -> 0 | G128: of:=[.D128]-[.E128] -> 0.00000003325788000552
A129: 01/05/1975 | B129: 1.0230587824 | C129: 1.0230587824 | D129: 0.48836020625676 | E129: 0.4883601737 | F129: of:=[.B129]-[.C129] -> 0 | G129: of:=[.D129]-[.E129] -> 0.00000003255676001013
A130: 01/06/1975 | B130: 1.018270298 | C130: 1.018270298 | D130: 0.47735302668641 | E130: 0.4773529948 | F130: of:=[.B130]-[.C130] -> 0 | G130: of:=[.D130]-[.E130] -> 0.00000003188641001239
A131: 01/07/1975 | B131: 1.0171040496 | C131: 1.0171040496 | D131: 0.46878812789098 | E131: 0.4687880966 | F131: of:=[.B131]-[.C131] -> 0 | G131: of:=[.D131]-[.E131] -> 0.0000000312909800293
A132: 01/08/1975 | B132: 1.0155799192 | C132: 1.0155799192 | D132: 0.46090478951032 | E132: 0.4609047587 | F132: of:=[.B132]-[.C132] -> 0 | G132: of:=[.D132]-[.E132] -> 0.0000000308103200175
A133: 01/09/1975 | B133: 1.0202922078 | C133: 1.0202922078 | D133: 0.45383409104168 | E133: 0.4538340607 | F133: of:=[.B133]-[.C133] -> 0 | G133: of:=[.D133]-[.E133] -> 0.00000003034168000182
A134: 01/10/1975 | B134: 1.0217183771 | C134: 1.0217183771 | D134: 0.44480795557604 | E134: 0.4448079259 | F134: of:=[.B134]-[.C134] -> 0 | G134: of:=[.D134]-[.E134] -> 0.00000002967604001425
A135: 01/11/1975 | B135: 1.0194658569 | C135: 1.0194658569 | D135: 0.43535279930911 | E135: 0.4353527703 | F135: of:=[.B135]-[.C135] -> 0 | G135: of:=[.D135]-[.E135] -> 0.00000002900910994752
A136: 01/12/1975 | B136: 1.0184067823 | C136: 1.0184067823 | D136: 0.42704009787334 | E136: 0.4270400694 | F136: of:=[.B136]-[.C136] -> 0 | G136: of:=[.D136]-[.E136] -> 0.0000000284733400191
A137: 01/01/1976 | B137: 1.01919904 | C137: 1.01919904 | D137: 0.41932173400191 | E137: 0.419321706 | F137: of:=[.B137]-[.C137] -> 0 | G137: of:=[.D137]-[.E137] -> 0.00000002800190995744
A138: 01/02/1976 | B138: 1.0223693893 | C138: 1.0223693893 | D138: 0.41142281099667 | E138: 0.4114227835 | F138: of:=[.B138]-[.C138] -> 0 | G138: of:=[.D138]-[.E138] -> 0.00000002749666999646
A139: 01/03/1976 | B139: 1.0237512595 | C139: 1.0237512595 | D139: 0.40242090119538 | E139: 0.4024208744 | F139: of:=[.B139]-[.C139] -> 0 | G139: of:=[.D139]-[.E139] -> 0.00000002679537997041
A140: 01/04/1976 | B140: 1.0252390326 | C140: 1.0252390326 | D140: 0.39308464576827 | E140: 0.3930846195 | F140: of:=[.B140]-[.C140] -> 0 | G140: of:=[.D140]-[.E140] -> 0.00000002626827000363
A141: 01/05/1976 | B141: 1.0297606802 | C141: 1.0297606802 | D141: 0.3834078037113 | E141: 0.3834077781 | F141: of:=[.B141]-[.C141] -> 0 | G141: of:=[.D141]-[.E141] -> 0.00000002561130002521
A142: 01/06/1976 | B142: 1.0294999001 | C142: 1.0294999001 | D142: 0.37232709607522 | E142: 0.3723270712 | F142: of:=[.B142]-[.C142] -> 0 | G142: of:=[.D142]-[.E142] -> 0.00000002487521999495
A143: 01/07/1976 | B143: 1.025549806 | C143: 1.025549806 | D143: 0.36165821486631 | E143: 0.3616581907 | F143: of:=[.B143]-[.C143] -> 0 | G143: of:=[.D143]-[.E143] -> 0.00000002416631000868
A144: 01/08/1976 | B144: 1.0278776411 | C144: 1.0278776411 | D144: 0.35264812371903 | E144: 0.3526481002 | F144: of:=[.B144]-[.C144] -> 0 | G144: of:=[.D144]-[.E144] -> 0.00000002351903000131
A145: 01/09/1976 | B145: 1.0328894889 | C145: 1.0328894889 | D145: 0.34308375785044 | E145: 0.3430837349 | F145: of:=[.B145]-[.C145] -> 0 | G145: of:=[.D145]-[.E145] -> 0.0000000229504399929
A146: 01/10/1976 | B146: 1.03606012 | C146: 1.03606012 | D146: 0.33215921116189 | E146: 0.332159189 | F146: of:=[.B146]-[.C146] -> 0 | G146: of:=[.D146]-[.E146] -> 0.00000002216188998982
A147: 01/11/1976 | B147: 1.0302752294 | C147: 1.0302752294 | D147: 0.32059839458148 | E147: 0.3205983732 | F147: of:=[.B147]-[.C147] -> 0 | G147: of:=[.D147]-[.E147] -> 0.00000002138147997544
A148: 01/12/1976 | B148: 1.0220948353 | C148: 1.0220948353 | D148: 0.31117742660685 | E148: 0.3111774059 | F148: of:=[.B148]-[.C148] -> 0 | G148: of:=[.D148]-[.E148] -> 0.00000002070685001243
A149: 01/01/1977 | B149: 1.0173155459 | C149: 1.0173155459 | D149: 0.30445063986212 | E149: 0.3044506196 | F149: of:=[.B149]-[.C149] -> 0 | G149: of:=[.D149]-[.E149] -> 0.00000002026211998185
A150: 01/02/1977 | B150: 1.0196970508 | C150: 1.0196970508 | D150: 0.29926863998994 | E150: 0.29926862 | F150: of:=[.B150]-[.C150] -> 0 | G150: of:=[.D150]-[.E150] -> 0.0000000199899400366
A151: 01/03/1977 | B151: 1.022675975 | C151: 1.022675975 | D151: 0.29348779596367 | E151: 0.2934877764 | F151: of:=[.B151]-[.C151] -> 0 | G151: of:=[.D151]-[.E151] -> 0.00000001956366996181
A152: 01/04/1977 | B152: 1.0288456603 | C152: 1.0288456603 | D152: 0.28698023923332 | E152: 0.2869802201 | F152: of:=[.B152]-[.C152] -> 0 | G152: of:=[.D152]-[.E152] -> 0.00000001913331998393
A153: 01/05/1977 | B153: 1.0321776004 | C153: 1.0321776004 | D153: 0.27893419810863 | E153: 0.2789341795 | F153: of:=[.B153]-[.C153] -> 0 | G153: of:=[.D153]-[.E153] -> 0.00000001860863002578
A154: 01/06/1977 | B154: 1.0333494442 | C154: 1.0333494442 | D154: 0.2702385694095 | E154: 0.2702385514 | F154: of:=[.B154]-[.C154] -> 0 | G154: of:=[.D154]-[.E154] -> 0.0000000180094999469
A155: 01/07/1977 | B155: 1.026707203 | C155: 1.026707203 | D155: 0.26151711884716 | E155: 0.2615171014 | F155: of:=[.B155]-[.C155] -> 0 | G155: of:=[.D155]-[.E155] -> 0.00000001744715999452
A156: 01/08/1977 | B156: 1.020500205 | C156: 1.020500205 | D156: 0.25471440940807 | E156: 0.2547143924 | F156: of:=[.B156]-[.C156] -> 0 | G156: of:=[.D156]-[.E156] -> 0.00000001700807000793
A157: 01/09/1977 | B157: 1.0140172314 | C157: 1.0140172314 | D157: 0.2495976072911 | E157: 0.2495975907 | F157: of:=[.B157]-[.C157] -> 0 | G157: of:=[.D157]-[.E157] -> 0.00000001659109999386
A158: 01/10/1977 | B158: 1.0138674884 | C158: 1.0138674884 | D158: 0.24614730357835 | E158: 0.2461472872 | F158: of:=[.B158]-[.C158] -> 0 | G158: of:=[.D158]-[.E158] -> 0.0000000163783499818
A159: 01/11/1977 | B159: 1.0149370386 | C159: 1.0149370386 | D159: 0.24278054715691 | E159: 0.242780531 | F159: of:=[.B159]-[.C159] -> 0 | G159: of:=[.D159]-[.E159] -> 0.00000001615691000434
A160: 01/12/1977 | B160: 1.0195944212 | C160: 1.0195944212 | D160: 0.23920749556229 | E160: 0.2392074796 | F160: of:=[.B160]-[.C160] -> 0 | G160: of:=[.D160]-[.E160] -> 0.00000001596229001755
A161: 01/01/1978 | B161: 1.0211060759 | C161: 1.0211060759 | D161: 0.23461043978718 | E161: 0.2346104241 | F161: of:=[.B161]-[.C161] -> 0 | G161: of:=[.D161]-[.E161] -> 0.00000001568717999945
A162: 01/02/1978 | B162: 1.0231764948 | C162: 1.0231764948 | D162: 0.22976108489061 | E162: 0.2297610696 | F162: of:=[.B162]-[.C162] -> 0 | G162: of:=[.D162]-[.E162] -> 0.00000001529061000038
A163: 01/03/1978 | B163: 1.025784168 | C163: 1.025784168 | D163: 0.22455664888541 | E163: 0.2245566339 | F163: of:=[.B163]-[.C163] -> 0 | G163: of:=[.D163]-[.E163] -> 0.00000001498540999623
A164: 01/04/1978 | B164: 1.0292079402 | C164: 1.0292079402 | D164: 0.21891218044751 | E164: 0.2189121659 | F164: of:=[.B164]-[.C164] -> 0 | G164: of:=[.D164]-[.E164] -> 0.00000001454751000218
A165: 01/05/1978 | B165: 1.0304713356 | C165: 1.0304713356 | D165: 0.21269966145517 | E165: 0.2126996473 | F165: of:=[.B165]-[.C165] -> 0 | G165: of:=[.D165]-[.E165] -> 0.00000001415517000836
A166: 01/06/1978 | B166: 1.0301240402 | C166: 1.0301240402 | D166: 0.20641007091315 | E166: 0.2064100572 | F166: of:=[.B166]-[.C166] -> 0 | G166: of:=[.D166]-[.E166] -> 0.00000001371315000442
A167: 01/07/1978 | B167: 1.0306049312 | C167: 1.0306049312 | D167: 0.20037399658499 | E167: 0.2003739832 | F167: of:=[.B167]-[.C167] -> 0 | G167: of:=[.D167]-[.E167] -> 0.00000001338499000525
A168: 01/08/1978 | B168: 1.0277835733 | C168: 1.0277835733 | D168: 0.19442367343584 | E168: 0.1944236605 | F168: of:=[.B168]-[.C168] -> 0 | G168: of:=[.D168]-[.E168] -> 0.00000001293583998252
A169: 01/09/1978 | B169: 1.0261190243 | C169: 1.0261190243 | D169: 0.1891679128628 | E169: 0.1891679003 | F169: of:=[.B169]-[.C169] -> 0 | G169: of:=[.D169]-[.E169] -> 0.00000001256279999473
A170: 01/10/1978 | B170: 1.0237396551 | C170: 1.0237396551 | D170: 0.18435279766092 | E170: 0.1843527854 | F170: of:=[.B170]-[.C170] -> 0 | G170: of:=[.D170]-[.E170] -> 0.00000001226092000151
A171: 01/11/1978 | B171: 1.0256046894 | C171: 1.0256046894 | D171: 0.18007781250099 | E171: 0.1800778005 | F171: of:=[.B171]-[.C171] -> 0 | G171: of:=[.D171]-[.E171] -> 0.00000001200099000731
A172: 01/12/1978 | B172: 1.0263157895 | C172: 1.0263157895 | D172: 0.1755820876817 | E172: 0.175582076 | F172: of:=[.B172]-[.C172] -> 0 | G172: of:=[.D172]-[.E172] -> 0.00000001168169999621
A173: 01/01/1979 | B173: 1.0225812374 | C173: 1.0225812374 | D173: 0.17107998286496 | E173: 0.1710799715 | F173: of:=[.B173]-[.C173] -> 0 | G173: of:=[.D173]-[.E173] -> 0.00000001136496000087
A174: 01/02/1979 | B174: 1.0232495512 | C174: 1.0232495512 | D174: 0.1673020945504 | E174: 0.1673020834 | F174: of:=[.B174]-[.C174] -> 0 | G174: of:=[.D174]-[.E174] -> 0.00000001115039999222
A175: 01/03/1979 | B175: 1.0249729508 | C175: 1.0249729508 | D175: 0.16350077491282 | E175: 0.1635007641 | F175: of:=[.B175]-[.C175] -> 0 | G175: of:=[.D175]-[.E175] -> 0.00000001081282000048
A176: 01/04/1979 | B176: 1.0374597016 | C176: 1.0374597016 | D176: 0.15951716070674 | E176: 0.1595171501 | F176: of:=[.B176]-[.C176] -> 0 | G176: of:=[.D176]-[.E176] -> 0.00000001060673998632
A177: 01/05/1979 | B177: 1.0382246178 | C177: 1.0382246178 | D177: 0.1537574524203 | E177: 0.1537574422 | F177: of:=[.B177]-[.C177] -> 0 | G177: of:=[.D177]-[.E177] -> 0.0000000102202999952
A178: 01/06/1979 | B178: 1.0332679981 | C178: 1.0332679981 | D178: 0.14809651956251 | E178: 0.1480965097 | F178: of:=[.B178]-[.C178] -> 0 | G178: of:=[.D178]-[.E178] -> 0.00000000986251000312
A179: 01/07/1979 | B179: 1.0271981543 | C179: 1.0271981543 | D179: 0.14332827478915 | E179: 0.1433282653 | F179: of:=[.B179]-[.C179] -> 0 | G179: of:=[.D179]-[.E179] -> 0.00000000948914999355
A180: 01/08/1979 | B180: 1.0287739263 | C180: 1.0287739263 | D180: 0.13953322851015 | E180: 0.1395332192 | F180: of:=[.B180]-[.C180] -> 0 | G180: of:=[.D180]-[.E180] -> 0.00000000931014998429
A181: 01/09/1979 | B181: 1.0401707743 | C181: 1.0401707743 | D181: 0.13563060352043 | E181: 0.1356305945 | F181: of:=[.B181]-[.C181] -> 0 | G181: of:=[.D181]-[.E181] -> 0.0000000090204299863
A182: 01/10/1979 | B182: 1.0458722015 | C182: 1.0458722015 | D182: 0.13039263058675 | E182: 0.1303926219 | F182: of:=[.B182]-[.C182] -> 0 | G182: of:=[.D182]-[.E182] -> 0.000000008686749986
A183: 01/11/1979 | B183: 1.0451312239 | C183: 1.0451312239 | D183: 0.12467357904698 | E183: 0.1246735708 | F183: of:=[.B183]-[.C183] -> 0 | G183: of:=[.D183]-[.E183] -> 0.00000000824698000168
A184: 01/12/1979 | B184: 1.0407928143 | C184: 1.0407928143 | D184: 0.11928988073072 | E184: 0.1192898728 | F184: of:=[.B184]-[.C184] -> 0 | G184: of:=[.D184]-[.E184] -> 0.00000000793071999738
A185: 01/01/1980 | B185: 1.0420228358 | C185: 1.0420228358 | D185: 0.11461443535325 | E185: 0.1146144277 | F185: of:=[.B185]-[.C185] -> 0 | G185: of:=[.D185]-[.E185] -> 0.00000000765325000596
A186: 01/02/1980 | B186: 1.0370035213 | C186: 1.0370035213 | D186: 0.10999224912884 | E186: 0.1099922418 | F186: of:=[.B186]-[.C186] -> 0 | G186: of:=[.D186]-[.E186] -> 0.00000000732883999321
A187: 01/03/1980 | B187: 1.0369920704 | C187: 1.0369920704 | D187: 0.10606738248193 | E187: 0.1060673754 | F187: of:=[.B187]-[.C187] -> 0 | G187: of:=[.D187]-[.E187] -> 0.00000000708193000076
A188: 01/04/1980 | B188: 1.0369896092 | C188: 1.0369896092 | D188: 0.10228369677024 | E188: 0.10228369 | F188: of:=[.B188]-[.C188] -> 0 | G188: of:=[.D188]-[.E188] -> 0.0000000067702400075
A189: 01/05/1980 | B189: 1.0339942843 | C189: 1.0339942843 | D189: 0.09863521858155 | E189: 0.098635212 | F189: of:=[.B189]-[.C189] -> 0 | G189: of:=[.D189]-[.E189] -> 0.00000000658154999944
A190: 01/06/1980 | B190: 1.0320065514 | C190: 1.0320065514 | D190: 0.0953924214855 | E190: 0.0953924151 | F190: of:=[.B190]-[.C190] -> 0 | G190: of:=[.D190]-[.E190] -> 0.00000000638550000376
A191: 01/07/1980 | B191: 1.0320058192 | C191: 1.0320058192 | D191: 0.09243393014908 | E191: 0.092433924 | F191: of:=[.B191]-[.C191] -> 0 | G191: of:=[.D191]-[.E191] -> 0.00000000614907999519
A192: 01/08/1980 | B192: 1.0320064077 | C192: 1.0320064077 | D192: 0.08956725672413 | E192: 0.0895672508 | F192: of:=[.B192]-[.C192] -> 0 | G192: of:=[.D192]-[.E192] -> 0.000000005924130006
A193: 01/09/1980 | B193: 1.0300048119 | C193: 1.0300048119 | D193: 0.08678943856923 | E193: 0.0867894328 | F193: of:=[.B193]-[.C193] -> 0 | G193: of:=[.D193]-[.E193] -> 0.00000000576923001039
A194: 01/10/1980 | B194: 1.0319940925 | C194: 1.0319940925 | D194: 0.08426119719687 | E194: 0.0842611916 | F194: of:=[.B194]-[.C194] -> 0 | G194: of:=[.D194]-[.E194] -> 0.00000000559687000912
A195: 01/11/1980 | B195: 1.0319952102 | C195: 1.0319952102 | D195: 0.08164891428084 | E195: 0.0816489088 | F195: of:=[.B195]-[.C195] -> 0 | G195: of:=[.D195]-[.E195] -> 0.00000000548083999019
A196: 01/12/1980 | B196: 1.0449978775 | C196: 1.0449978775 | D196: 0.07911753220736 | E196: 0.0791175269 | F196: of:=[.B196]-[.C196] -> 0 | G196: of:=[.D196]-[.E196] -> 0.00000000530735999593
A197: 01/01/1981 | B197: 1.0500067705 | C197: 1.0500067705 | D197: 0.07571071091229 | E197: 0.0757107059 | F197: of:=[.B197]-[.C197] -> 0 | G197: of:=[.D197]-[.E197] -> 0.00000000501228999972
A198: 01/02/1981 | B198: 1.0649961957 | C198: 1.0649961957 | D198: 0.07210497402435 | E198: 0.0721049692 | F198: of:=[.B198]-[.C198] -> 0 | G198: of:=[.D198]-[.E198] -> 0.00000000482435000282
A199: 01/03/1981 | B199: 1.0630032815 | C199: 1.0630032815 | D199: 0.06770444280973 | E199: 0.0677044383 | F199: of:=[.B199]-[.C199] -> 0 | G199: of:=[.D199]-[.E199] -> 0.00000000450972999222
A200: 01/04/1981 | B200: 1.0599981774 | C200: 1.0599981774 | D200: 0.06369165927145 | E200: 0.063691655 | F200: of:=[.B200]-[.C200] -> 0 | G200: of:=[.D200]-[.E200] -> 0.00000000427144999926
A201: 01/05/1981 | B201: 1.0599980656 | C201: 1.0599980656 | D201: 0.0600865743257 | E201: 0.0600865703 | F201: of:=[.B201]-[.C201] -> 0 | G201: of:=[.D201]-[.E201] -> 0.00000000402569999558
A202: 01/06/1981 | B202: 1.0599983779 | C202: 1.0599983779 | D202: 0.05668555092285 | E202: 0.0566855471 | F202: of:=[.B202]-[.C202] -> 0 | G202: of:=[.D202]-[.E202] -> 0.00000000382285000183
A203: 01/07/1981 | B203: 1.0599977045 | C203: 1.0599977045 | D203: 0.05347701666785 | E203: 0.0534770131 | F203: of:=[.B203]-[.C203] -> 0 | G203: of:=[.D203]-[.E203] -> 0.00000000356785000155
A204: 01/08/1981 | B204: 1.0580003068 | C204: 1.0580003068 | D204: 0.05045012497747 | E204: 0.0504501216 | F204: of:=[.B204]-[.C204] -> 0 | G204: of:=[.D204]-[.E204] -> 0.00000000337746999812
A205: 01/09/1981 | B205: 1.0570039657 | C205: 1.0570039657 | D205: 0.04768441431747 | E205: 0.0476844111 | F205: of:=[.B205]-[.C205] -> 0 | G205: of:=[.D205]-[.E205] -> 0.0000000032174700057
A206: 01/10/1981 | B206: 1.0570038487 | C206: 1.0570038487 | D206: 0.04511280550012 | E206: 0.0451128025 | F206: of:=[.B206]-[.C206] -> 0 | G206: of:=[.D206]-[.E206] -> 0.00000000300011999965
A207: 01/11/1981 | B207: 1.0549983207 | C207: 1.0549983207 | D207: 0.04267988764241 | E207: 0.0426798848 | F207: of:=[.B207]-[.C207] -> 0 | G207: of:=[.D207]-[.E207] -> 0.00000000284241000181
A208: 01/12/1981 | B208: 1.0520009551 | C208: 1.0520009551 | D208: 0.04045493419752 | E208: 0.0404549315 | F208: of:=[.B208]-[.C208] -> 0 | G208: of:=[.D208]-[.E208] -> 0.00000000269751999904
A209: 01/01/1982 | B209: 1.0500013756 | C209: 1.0500013756 | D209: 0.03845522573093 | E209: 0.0384552232 | F209: of:=[.B209]-[.C209] -> 0 | G209: of:=[.D209]-[.E209] -> 0.0000000025309300003
A210: 01/02/1982 | B210: 1.0499980349 | C210: 1.0499980349 | D210: 0.03662397652475 | E210: 0.0366239741 | F210: of:=[.B210]-[.C210] -> 0 | G210: of:=[.D210]-[.E210] -> 0.00000000242475000495
A211: 01/03/1982 | B211: 1.0500003119 | C211: 1.0500003119 | D211: 0.03488004292145 | E211: 0.0348800406 | F211: of:=[.B211]-[.C211] -> 0 | G211: of:=[.D211]-[.E211] -> 0.00000000232144999751
A212: 01/04/1982 | B212: 1.0549983959 | C212: 1.0549983959 | D212: 0.03321907862897 | E212: 0.0332190764 | F212: of:=[.B212]-[.C212] -> 0 | G212: of:=[.D212]-[.E212] -> 0.00000000222897000163
A213: 01/05/1982 | B213: 1.0549977192 | C213: 1.0549977192 | D213: 0.03148732619696 | E213: 0.0314873241 | F213: of:=[.B213]-[.C213] -> 0 | G213: of:=[.D213]-[.E213] -> 0.00000000209696000147
A214: 01/06/1982 | B214: 1.0550024822 | C214: 1.0550024822 | D214: 0.02984587134542 | E214: 0.0298458694 | F214: of:=[.B214]-[.C214] -> 0 | G214: of:=[.D214]-[.E214] -> 0.00000000194542000218
A215: 01/07/1982 | B215: 1.0599976725 | C215: 1.0599976725 | D215: 0.02828985888562 | E215: 0.028289857 | F215: of:=[.B215]-[.C215] -> 0 | G215: of:=[.D215]-[.E215] -> 0.00000000188561999695
A216: 01/08/1982 | B216: 1.0700003341 | C216: 1.0700003341 | D216: 0.02668860472014 | E216: 0.0266886029 | F216: of:=[.B216]-[.C216] -> 0 | G216: of:=[.D216]-[.E216] -> 0.00000000182014000052
A217: 01/09/1982 | B217: 1.0699978587 | C217: 1.0699978587 | D217: 0.02494261344562 | E217: 0.0249426118 | F217: of:=[.B217]-[.C217] -> 0 | G217: of:=[.D217]-[.E217] -> 0.00000000164562000138
A218: 01/10/1982 | B218: 1.0700006254 | C218: 1.0700006254 | D218: 0.02331090033762 | E218: 0.0233108988 | F218: of:=[.B218]-[.C218] -> 0 | G218: of:=[.D218]-[.E218] -> 0.00000000153762000007
A219: 01/11/1982 | B219: 1.0650002922 | C219: 1.0650002922 | D219: 0.02178587543246 | E219: 0.021785874 | F219: of:=[.B219]-[.C219] -> 0 | G219: of:=[.D219]-[.E219] -> 0.00000000143246000131
A220: 01/12/1982 | B220: 1.0649990671 | C220: 1.0649990671 | D220: 0.02045621545085 | E220: 0.0204562141 | F220: of:=[.B220]-[.C220] -> 0 | G220: of:=[.D220]-[.E220] -> 0.00000000135084999783
A221: 01/01/1983 | B221: 1.0600014428 | C221: 1.0600014428 | D221: 0.01920773086361 | E221: 0.0192077296 | F221: of:=[.B221]-[.C221] -> 0 | G221: of:=[.D221]-[.E221] -> 0.00000000126360999789
A222: 01/02/1983 | B222: 1.0669985319 | C222: 1.0669985319 | D222: 0.01812047615036 | E222: 0.0181204749 | F222: of:=[.B222]-[.C222] -> 0 | G222: of:=[.D222]-[.E222] -> 0.00000000125035999957
A223: 01/03/1983 | B223: 1.0900003645 | C223: 1.0900003645 | D223: 0.01698266268286 | E223: 0.0169826616 | F223: of:=[.B223]-[.C223] -> 0 | G223: of:=[.D223]-[.E223] -> 0.00000000108285999958
A224: 01/04/1983 | B224: 1.0900009196 | C224: 1.0900009196 | D224: 0.01558041926954 | E224: 0.0155804182 | F224: of:=[.B224]-[.C224] -> 0 | G224: of:=[.D224]-[.E224] -> 0.00000000106953999997
A225: 01/05/1983 | B225: 1.0800003068 | C225: 1.0800003068 | D225: 0.01429395057323 | E225: 0.0142939496 | F225: of:=[.B225]-[.C225] -> 0 | G225: of:=[.D225]-[.E225] -> 0.00000000097323000006
A226: 01/06/1983 | B226: 1.0779990247 | C226: 1.0779990247 | D226: 0.0132351356599 | E226: 0.0132351348 | F226: of:=[.B226]-[.C226] -> 0 | G226: of:=[.D226]-[.E226] -> 0.00000000085990000016
A227: 01/07/1983 | B227: 1.0899990119 | C227: 1.0899990119 | D227: 0.01227750244355 | E227: 0.0122775016 | F227: of:=[.B227]-[.C227] -> 0 | G227: of:=[.D227]-[.E227] -> 0.00000000084354999895
A228: 01/08/1983 | B228: 1.0849995266 | C228: 1.0849995266 | D228: 0.01126377392044 | E228: 0.0112637732 | F228: of:=[.B228]-[.C228] -> 0 | G228: of:=[.D228]-[.E228] -> 0.00000000072043999932
A229: 01/09/1983 | B229: 1.0949991088 | C229: 1.0949991088 | D229: 0.01038136298155 | E229: 0.0103813623 | F229: of:=[.B229]-[.C229] -> 0 | G229: of:=[.D229]-[.E229] -> 0.00000000068154999873
A230: 01/10/1983 | B230: 1.0970005884 | C230: 1.0970005884 | D230: 0.00948070450297 | E230: 0.0094807039 | F230: of:=[.B230]-[.C230] -> 0 | G230: of:=[.D230]-[.E230] -> 0.00000000060297000032
A231: 01/11/1983 | B231: 1.0839996599 | C231: 1.0839996599 | D231: 0.00864238780109 | E231: 0.0086423872 | F231: of:=[.B231]-[.C231] -> 0 | G231: of:=[.D231]-[.E231] -> 0.00000000060108999896
A232: 01/12/1983 | B232: 1.0760003936 | C232: 1.0760003936 | D232: 0.00797268497472 | E232: 0.0079726844 | F232: of:=[.B232]-[.C232] -> 0 | G232: of:=[.D232]-[.E232] -> 0.00000000057471999902
A233: 01/01/1984 | B233: 1.0980005248 | C233: 1.0980005248 | D233: 0.00740955581628 | E233: 0.0074095553 | F233: of:=[.B233]-[.C233] -> 0 | G233: of:=[.D233]-[.E233] -> 0.00000000051628000052
A234: 01/02/1984 | B234: 1.1230005709 | C234: 1.1230005709 | D234: 0.00674822611549 | E234: 0.0067482257 | F234: of:=[.B234]-[.C234] -> 0 | G234: of:=[.D234]-[.E234] -> 0.00000000041549000004
A235: 01/03/1984 | B235: 1.0999998925 | C235: 1.0999998925 | D235: 0.00600910301416 | E235: 0.0060091026 | F235: of:=[.B235]-[.C235] -> 0 | G235: of:=[.D235]-[.E235] -> 0.0000000004141599997
A236: 01/04/1984 | B236: 1.0889998798 | C236: 1.0889998798 | D236: 0.00546282145583 | E236: 0.0054628211 | F236: of:=[.B236]-[.C236] -> 0 | G236: of:=[.D236]-[.E236] -> 0.00000000035583000001
A237: 01/05/1984 | B237: 1.088999721 | C237: 1.088999721 | D237: 0.0050163655269 | E237: 0.0050163652 | F237: of:=[.B237]-[.C237] -> 0 | G237: of:=[.D237]-[.E237] -> 0.00000000032690000012
A238: 01/06/1984 | B238: 1.0919996573 | C238: 1.0919996573 | D238: 0.00460639743993 | E238: 0.0046063971 | F238: of:=[.B238]-[.C238] -> 0 | G238: of:=[.D238]-[.E238] -> 0.00000000033992999995
A239: 01/07/1984 | B239: 1.1029999238 | C239: 1.1029999238 | D239: 0.00421831399775 | E239: 0.0042183137 | F239: of:=[.B239]-[.C239] -> 0 | G239: of:=[.D239]-[.E239] -> 0.00000000029775
A240: 01/08/1984 | B240: 1.106000041 | C240: 1.106000041 | D240: 0.00382440098746 | E240: 0.0038244007 | F240: of:=[.B240]-[.C240] -> 0 | G240: of:=[.D240]-[.E240] -> 0.00000000028745999981
A241: 01/09/1984 | B241: 1.1049740841 | C241: 1.1049740841 | D241: 0.00345786694909 | E241: 0.0034578667 | F241: of:=[.B241]-[.C241] -> 0 | G241: of:=[.D241]-[.E241] -> 0.00000000024908999993
A242: 01/10/1984 | B242: 1.1260261935 | C242: 1.1260261935 | D242: 0.00312936475058 | E242: 0.0031293645 | F242: of:=[.B242]-[.C242] -> 0 | G242: of:=[.D242]-[.E242] -> 0.00000000025057999989
A243: 01/11/1984 | B243: 1.0989998862 | C243: 1.0989998862 | D243: 0.00277912251833 | E243: 0.0027791223 | F243: of:=[.B243]-[.C243] -> 0 | G243: of:=[.D243]-[.E243] -> 0.00000000021833000035
A244: 01/12/1984 | B244: 1.1050000769 | C244: 1.1050000769 | D244: 0.00252877416388 | E244: 0.002528774 | F244: of:=[.B244]-[.C244] -> 0 | G244: of:=[.D244]-[.E244] -> 0.00000000016387999985
A245: 01/01/1985 | B245: 1.126000018 | C245: 1.126000018 | D245: 0.00228848324696 | E245: 0.0022884831 | F245: of:=[.B245]-[.C245] -> 0 | G245: of:=[.D245]-[.E245] -> 0.00000000014696000016
A246: 01/02/1985 | B246: 1.1019999637 | C246: 1.1019999637 | D246: 0.0020324007197 | E246: 0.0020324006 | F246: of:=[.B246]-[.C246] -> 0 | G246: of:=[.D246]-[.E246] -> 0.00000000011969999991
A247: 01/03/1985 | B247: 1.1269998552 | C247: 1.1269998552 | D247: 0.00184428383543 | E247: 0.0018442837 | F247: of:=[.B247]-[.C247] -> 0 | G247: of:=[.D247]-[.E247] -> 0.00000000013543000011
A248: 01/04/1985 | B248: 1.1182930081 | C248: 1.1182930081 | D248: 0.00163645436769 | E248: 0.0016364543 | F248: of:=[.B248]-[.C248] -> 0 | G248: of:=[.D248]-[.E248] -> 0.00000000006769000009
A249: 01/05/1985 | B249: 1.1000589922 | C249: 1.1000589922 | D249: 0.00146335026316 | E249: 0.0014633502 | F249: of:=[.B249]-[.C249] -> 0 | G249: of:=[.D249]-[.E249] -> 0.00000000006316000002
A250: 01/06/1985 | B250: 1.0920819974 | C250: 1.0920819974 | D250: 0.00133024708087 | E250: 0.001330247 | F250: of:=[.B250]-[.C250] -> 0 | G250: of:=[.D250]-[.E250] -> 0.00000000008087000015
A251: 01/07/1985 | B251: 1.0761399689 | C251: 1.0761399689 | D251: 0.00121808351757 | E251: 0.0012180834 | F251: of:=[.B251]-[.C251] -> 0 | G251: of:=[.D251]-[.E251] -> 0.00000000011756999996
A252: 01/08/1985 | B252: 1.081797069 | C252: 1.081797069 | D252: 0.00113190063818 | E252: 0.0011319006 | F252: of:=[.B252]-[.C252] -> 0 | G252: of:=[.D252]-[.E252] -> 0.00000000003818000018
A253: 01/09/1985 | B253: 1.0909999364 | C253: 1.0909999364 | D253: 0.0010463151275 | E253: 0.0010463151 | F253: of:=[.B253]-[.C253] -> 0 | G253: of:=[.D253]-[.E253] -> 0.00000000002750000011
A254: 01/10/1985 | B254: 1.0900000343 | C254: 1.0900000343 | D254: 0.00095904233593 | E254: 0.0009590423 | F254: of:=[.B254]-[.C254] -> 0 | G254: of:=[.D254]-[.E254] -> 0.00000000003592999997
A255: 01/11/1985 | B255: 1.1111999864 | C255: 1.1111999864 | D255: 0.00087985532638 | E255: 0.0008798553 | F255: of:=[.B255]-[.C255] -> 0 | G255: of:=[.D255]-[.E255] -> 0.00000000002637999996
A256: 01/12/1985 | B256: 1.1336000522 | C256: 1.1336000522 | D256: 0.00079180645891 | E256: 0.0007918064 | F256: of:=[.B256]-[.C256] -> 0 | G256: of:=[.D256]-[.E256] -> 0.00000000005891000003
A257: 01/01/1986 | B257: 1.1623000597 | C257: 1.1623000597 | D257: 0.00069848837549 | E257: 0.0006984883 | F257: of:=[.B257]-[.C257] -> 0 | G257: of:=[.D257]-[.E257] -> 0.00000000007548999999
A258: 01/02/1986 | B258: 0.0011436015 | C258: 0.0011436015 | D258: 0.00060095357447 | E258: 0.0006009535 | F258: of:=[.B258]-[.C258] -> 0 | G258: of:=[.D258]-[.E258] -> 0.00000000007446999994
A259: 01/03/1986 | B259: 1 | C259: 1 | D259: 0.52549211807865 | E259: 0.5254920703 | F259: of:=[.B259]-[.C259] -> 0 | G259: of:=[.D259]-[.E259] -> 0.00000004777865003636
A260: 01/04/1986 | B260: 1 | C260: 1 | D260: 0.52549211807865 | E260: 0.5254920703 | F260: of:=[.B260]-[.C260] -> 0 | G260: of:=[.D260]-[.E260] -> 0.00000004777865003636
A261: 01/05/1986 | B261: 1 | C261: 1 | D261: 0.52549211807865 | E261: 0.5254920703 | F261: of:=[.B261]-[.C261] -> 0 | G261: of:=[.D261]-[.E261] -> 0.00000004777865003636
A262: 01/06/1986 | B262: 1 | C262: 1 | D262: 0.52549211807865 | E262: 0.5254920703 | F262: of:=[.B262]-[.C262] -> 0 | G262: of:=[.D262]-[.E262] -> 0.00000004777865003636
A263: 01/07/1986 | B263: 1 | C263: 1 | D263: 0.52549211807865 | E263: 0.5254920703 | F263: of:=[.B263]-[.C263] -> 0 | G263: of:=[.D263]-[.E263] -> 0.00000004777865003636
A264: 01/08/1986 | B264: 1 | C264: 1 | D264: 0.52549211807865 | E264: 0.5254920703 | F264: of:=[.B264]-[.C264] -> 0 | G264: of:=[.D264]-[.E264] -> 0.00000004777865003636
A265: 01/09/1986 | B265: 1 | C265: 1 | D265: 0.52549211807865 | E265: 0.5254920703 | F265: of:=[.B265]-[.C265] -> 0 | G265: of:=[.D265]-[.E265] -> 0.00000004777865003636
A266: 01/10/1986 | B266: 1 | C266: 1 | D266: 0.52549211807865 | E266: 0.5254920703 | F266: of:=[.B266]-[.C266] -> 0 | G266: of:=[.D266]-[.E266] -> 0.00000004777865003636
A267: 01/11/1986 | B267: 1 | C267: 1 | D267: 0.52549211807865 | E267: 0.5254920703 | F267: of:=[.B267]-[.C267] -> 0 | G267: of:=[.D267]-[.E267] -> 0.00000004777865003636
A268: 01/12/1986 | B268: 1 | C268: 1 | D268: 0.52549211807865 | E268: 0.5254920703 | F268: of:=[.B268]-[.C268] -> 0 | G268: of:=[.D268]-[.E268] -> 0.00000004777865003636
A269: 01/01/1987 | B269: 1 | C269: 1 | D269: 0.52549211807865 | E269: 0.5254920703 | F269: of:=[.B269]-[.C269] -> 0 | G269: of:=[.D269]-[.E269] -> 0.00000004777865003636
A270: 01/02/1987 | B270: 1.7068609023 | C270: 1.7068609023 | D270: 0.52549211807865 | E270: 0.5254920703 | F270: of:=[.B270]-[.C270] -> 0 | G270: of:=[.D270]-[.E270] -> 0.00000004777865003636
A271: 01/03/1987 | B271: 1.1451461924 | C271: 1.1451461924 | D271: 0.30787049921323 | E271: 0.3078704712 | F271: of:=[.B271]-[.C271] -> 0 | G271: of:=[.D271]-[.E271] -> 0.00000002801323001345
A272: 01/04/1987 | B272: 1.2095975381 | C272: 1.2095975381 | D272: 0.2688482058068 | E272: 0.2688481814 | F272: of:=[.B272]-[.C272] -> 0 | G272: of:=[.D272]-[.E272] -> 0.00000002440680002547
A273: 01/05/1987 | B273: 1.2344172364 | C273: 1.2344172364 | D273: 0.22226252727754 | E273: 0.2222625071 | F273: of:=[.B273]-[.C273] -> 0 | G273: of:=[.D273]-[.E273] -> 0.00000002017753999994
A274: 01/06/1987 | B274: 1.1802080314 | C274: 1.1802080314 | D274: 0.18005462069352 | E274: 0.1800546043 | F274: of:=[.B274]-[.C274] -> 0 | G274: of:=[.D274]-[.E274] -> 0.00000001639351998595
A275: 01/07/1987 | B275: 1.0305056072 | C275: 1.0305056072 | D275: 0.15256176530161 | E275: 0.1525617514 | F275: of:=[.B275]-[.C275] -> 0 | G275: of:=[.D275]-[.E275] -> 0.00000001390161000203
A276: 01/08/1987 | B276: 1.0636004978 | C276: 1.0636004978 | D276: 0.1480455460268 | E276: 0.1480455326 | F276: of:=[.B276]-[.C276] -> 0 | G276: of:=[.D276]-[.E276] -> 0.00000001342680000516
A277: 01/09/1987 | B277: 1.0568099778 | C277: 1.0568099778 | D277: 0.1391928137802 | E277: 0.1391928011 | F277: of:=[.B277]-[.C277] -> 0 | G277: of:=[.D277]-[.E277] -> 0.00000001268019997336
A278: 01/10/1987 | B278: 1.0917999576 | C278: 1.0917999576 | D278: 0.13171035162817 | E278: 0.1317103396 | F278: of:=[.B278]-[.C278] -> 0 | G278: of:=[.D278]-[.E278] -> 0.0000000120281699878
A279: 01/11/1987 | B279: 1.1283982049 | C279: 1.1283982049 | D279: 0.1206359743022 | E279: 0.1206359633 | F279: of:=[.B279]-[.C279] -> 0 | G279: of:=[.D279]-[.E279] -> 0.00000001100219999828
A280: 01/12/1987 | B280: 1.1413984971 | C280: 1.1413984971 | D280: 0.10690904485521 | E280: 0.1069090351 | F280: of:=[.B280]-[.C280] -> 0 | G280: of:=[.D280]-[.E280] -> 0.00000000975521000091
A281: 01/01/1988 | B281: 1.1651087211 | C281: 1.1651087211 | D281: 0.09366496024556 | E281: 0.0936649517 | F281: of:=[.B281]-[.C281] -> 0 | G281: of:=[.D281]-[.E281] -> 0.00000000854555999574
A282: 01/02/1988 | B282: 1.1796117901 | C282: 1.1796117901 | D282: 0.08039160513461 | E282: 0.0803915978 | F282: of:=[.B282]-[.C282] -> 0 | G282: of:=[.D282]-[.E282] -> 0.00000000733460998881
A283: 01/03/1988 | B283: 1.1601009239 | C283: 1.1601009239 | D283: 0.06815089999041 | E283: 0.0681508938 | F283: of:=[.B283]-[.C283] -> 0 | G283: of:=[.D283]-[.E283] -> 0.00000000619041000405
A284: 01/04/1988 | B284: 1.1927986804 | C284: 1.1927986804 | D284: 0.05874566478346 | E284: 0.0587456594 | F284: of:=[.B284]-[.C284] -> 0 | G284: of:=[.D284]-[.E284] -> 0.00000000538346000417
A285: 01/05/1988 | B285: 1.1777991139 | C285: 1.1777991139 | D285: 0.04925027647059 | E285: 0.049250272 | F285: of:=[.B285]-[.C285] -> 0 | G285: of:=[.D285]-[.E285] -> 0.00000000447059000236
A286: 01/06/1988 | B286: 1.195300347 | C286: 1.195300347 | D286: 0.04181551496291 | E286: 0.0418155112 | F286: of:=[.B286]-[.C286] -> 0 | G286: of:=[.D286]-[.E286] -> 0.00000000376290999748
A287: 01/07/1988 | B287: 1.2403989338 | C287: 1.2403989338 | D287: 0.03498327016123 | E287: 0.034983267 | F287: of:=[.B287]-[.C287] -> 0 | G287: of:=[.D287]-[.E287] -> 0.00000000316122999999
A288: 01/08/1988 | B288: 1.2065998144 | C288: 1.2065998144 | D288: 0.02820324107669 | E288: 0.0282032385 | F288: of:=[.B288]-[.C288] -> 0 | G288: of:=[.D288]-[.E288] -> 0.00000000257669000026
A289: 01/09/1988 | B289: 1.2400984925 | C289: 1.2400984925 | D289: 0.02337414670556 | E289: 0.0233741446 | F289: of:=[.B289]-[.C289] -> 0 | G289: of:=[.D289]-[.E289] -> 0.00000000210556000066
A290: 01/10/1988 | B290: 1.2724995702 | C290: 1.2724995702 | D290: 0.0188486211756 | E290: 0.0188486195 | F290: of:=[.B290]-[.C290] -> 0 | G290: of:=[.D290]-[.E290] -> 0.00000000167559999903
A291: 01/11/1988 | B291: 1.269200711 | C291: 1.269200711 | D291: 0.01481228097597 | E291: 0.0148122796 | F291: of:=[.B291]-[.C291] -> 0 | G291: of:=[.D291]-[.E291] -> 0.0000000013759699994
A292: 01/12/1988 | B292: 1.287900578 | C292: 1.287900578 | D292: 0.01167055836606 | E292: 0.0116705573 | F292: of:=[.B292]-[.C292] -> 0 | G292: of:=[.D292]-[.E292] -> 0.00000000106605999896
A293: 01/01/1989 | B293: 1.4272 | C293: 1.4272 | D293: 9.06169200124071 | E293: 9.061691177 | F293: of:=[.B293]-[.C293] -> 0 | G293: of:=[.D293]-[.E293] -> 0.00000082424070946274
A294: 01/02/1989 | B294: 1.1014 | C294: 1.1014 | D294: 6.34927970938951 | E294: 6.3492791319 | F294: of:=[.B294]-[.C294] -> 0 | G294: of:=[.D294]-[.E294] -> 0.00000057748950954562
A295: 01/03/1989 | B295: 1.0609073359 | C295: 1.0609073359 | D295: 5.76473552695615 | E295: 5.7647350026 | F295: of:=[.B295]-[.C295] -> 0 | G295: of:=[.D295]-[.E295] -> 0.00000052435614961155
A296: 01/04/1989 | B296: 1.0730597762 | C296: 1.0730597762 | D296: 5.43377855151294 | E296: 5.4337780572 | F296: of:=[.B296]-[.C296] -> 0 | G296: of:=[.D296]-[.E296] -> 0.00000049431294080193
A297: 01/05/1989 | B297: 1.0993725623 | C297: 1.0993725623 | D297: 5.06381720015212 | E297: 5.0638167396 | F297: of:=[.B297]-[.C297] -> 0 | G297: of:=[.D297]-[.E297] -> 0.00000046055211999629
A298: 01/06/1989 | B298: 1.2483418171 | C298: 1.2483418171 | D298: 4.60609749033402 | E298: 4.6060970713 | F298: of:=[.B298]-[.C298] -> 0 | G298: of:=[.D298]-[.E298] -> 0.00000041903401992727
A299: 01/07/1989 | B299: 1.2875942172 | C299: 1.2875942172 | D299: 3.68977264659319 | E299: 3.6897723111 | F299: of:=[.B299]-[.C299] -> 0 | G299: of:=[.D299]-[.E299] -> 0.00000033549319011783
A300: 01/08/1989 | B300: 1.2934120244 | C300: 1.2934120244 | D300: 2.86563312983571 | E300: 2.8656328692 | F300: of:=[.B300]-[.C300] -> 0 | G300: of:=[.D300]-[.E300] -> 0.00000026063570990331
A301: 01/09/1989 | B301: 1.359511797 | C301: 1.359511797 | D301: 2.2155609162247 | E301: 2.2155607148 | F301: of:=[.B301]-[.C301] -> 0 | G301: of:=[.D301]-[.E301] -> 0.00000020142470003037
A302: 01/10/1989 | B302: 1.3762108767 | C302: 1.3762108767 | D302: 1.62967391758845 | E302: 1.6296737694 | F302: of:=[.B302]-[.C302] -> 0 | G302: of:=[.D302]-[.E302] -> 0.00000014818844995546
A303: 01/11/1989 | B303: 1.4142047032 | C303: 1.4142047032 | D303: 1.18417456596203 | E303: 1.1841744582 | F303: of:=[.B303]-[.C303] -> 0 | G303: of:=[.D303]-[.E303] -> 0.0000001077620299661
A304: 01/12/1989 | B304: 1.535499972 | C304: 1.535499972 | D304: 0.83734311113697 | E304: 0.837343035 | F304: of:=[.B304]-[.C304] -> 0 | G304: of:=[.D304]-[.E304] -> 0.00000007613697006192
A305: 01/01/1990 | B305: 1.5610949798 | C305: 1.5610949798 | D305: 0.54532277851254 | E305: 0.5453227289 | F305: of:=[.B305]-[.C305] -> 0 | G305: of:=[.D305]-[.E305] -> 0.00000004961253996516
A306: 01/02/1990 | B306: 1.7278028637 | C306: 1.7278028637 | D306: 0.34932069193023 | E306: 0.3493206602 | F306: of:=[.B306]-[.C306] -> 0 | G306: of:=[.D306]-[.E306] -> 0.00000003173022999903
A307: 01/03/1990 | B307: 1.8432 | C307: 1.8432 | D307: 0.20217624317521 | E307: 0.2021762248 | F307: of:=[.B307]-[.C307] -> 0 | G307: of:=[.D307]-[.E307] -> 0.00000001837520999248
A308: 01/04/1990 | B308: 1.448 | C308: 1.448 | D308: 0.10968763193099 | E308: 0.109687622 | F308: of:=[.B308]-[.C308] -> 0 | G308: of:=[.D308]-[.E308] -> 0.00000000993099000257
A309: 01/05/1990 | B309: 1.0787 | C309: 1.0787 | D309: 0.07575112702417 | E309: 0.0757511201 | F309: of:=[.B309]-[.C309] -> 0 | G309: of:=[.D309]-[.E309] -> 0.00000000692417000125
A310: 01/06/1990 | B310: 1.0955 | C310: 1.0955 | D310: 0.07022446187463 | E310: 0.0702244555 | F310: of:=[.B310]-[.C310] -> 0 | G310: of:=[.D310]-[.E310] -> 0.00000000637462999054
A311: 01/07/1990 | B311: 1.1292 | C311: 1.1292 | D311: 0.06410265803253 | E311: 0.0641026522 | F311: of:=[.B311]-[.C311] -> 0 | G311: of:=[.D311]-[.E311] -> 0.00000000583253000064
A312: 01/08/1990 | B312: 1.1203 | C312: 1.1203 | D312: 0.05676820583823 | E312: 0.0567682007 | F312: of:=[.B312]-[.C312] -> 0 | G312: of:=[.D312]-[.E312] -> 0.0000000051382300012
A313: 01/09/1990 | B313: 1.1276 | C313: 1.1276 | D313: 0.05067232512562 | E313: 0.0506723205 | F313: of:=[.B313]-[.C313] -> 0 | G313: of:=[.D313]-[.E313] -> 0.00000000462561999814
A314: 01/10/1990 | B314: 1.142 | C314: 1.142 | D314: 0.04493820958285 | E314: 0.0449382055 | F314: of:=[.B314]-[.C314] -> 0 | G314: of:=[.D314]-[.E314] -> 0.00000000408284999559
A315: 01/11/1990 | B315: 1.1558 | C315: 1.1558 | D315: 0.03935044621965 | E315: 0.0393504426 | F315: of:=[.B315]-[.C315] -> 0 | G315: of:=[.D315]-[.E315] -> 0.0000000036196499964
A316: 01/12/1990 | B316: 1.183 | C316: 1.183 | D316: 0.03404606871401 | E316: 0.0340460656 | F316: of:=[.B316]-[.C316] -> 0 | G316: of:=[.D316]-[.E316] -> 0.00000000311401000125
A317: 01/01/1991 | B317: 1.1991 | C317: 1.1991 | D317: 0.02877943255622 | E317: 0.0287794299 | F317: of:=[.B317]-[.C317] -> 0 | G317: of:=[.D317]-[.E317] -> 0.0000000026562200009
A318: 01/02/1991 | B318: 1.2187 | C318: 1.2187 | D318: 0.02400086110935 | E318: 0.0240008589 | F318: of:=[.B318]-[.C318] -> 0 | G318: of:=[.D318]-[.E318] -> 0.00000000220934999809
A319: 01/03/1991 | B319: 1.1179 | C319: 1.1179 | D319: 0.01969382219525 | E319: 0.0196938204 | F319: of:=[.B319]-[.C319] -> 0 | G319: of:=[.D319]-[.E319] -> 0.00000000179525000074
A320: 01/04/1991 | B320: 1.0501 | C320: 1.0501 | D320: 0.01761680131966 | E320: 0.0176167997 | F320: of:=[.B320]-[.C320] -> 0 | G320: of:=[.D320]-[.E320] -> 0.00000000161965999987
A321: 01/05/1991 | B321: 1.0668 | C321: 1.0668 | D321: 0.01677630827508 | E321: 0.0167763067 | F321: of:=[.B321]-[.C321] -> 0 | G321: of:=[.D321]-[.E321] -> 0.00000000157508000045
A322: 01/06/1991 | B322: 1.1083 | C322: 1.1083 | D322: 0.01572582327998 | E322: 0.0157258218 | F322: of:=[.B322]-[.C322] -> 0 | G322: of:=[.D322]-[.E322] -> 0.00000000147997999966
A323: 01/07/1991 | B323: 1.1214 | C323: 1.1214 | D323: 0.01418913947485 | E323: 0.0141891382 | F323: of:=[.B323]-[.C323] -> 0 | G323: of:=[.D323]-[.E323] -> 0.00000000127484999987
A324: 01/08/1991 | B324: 1.1562 | C324: 1.1562 | D324: 0.01265305820836 | E324: 0.0126530571 | F324: of:=[.B324]-[.C324] -> 0 | G324: of:=[.D324]-[.E324] -> 0.00000000110835999927
A325: 01/09/1991 | B325: 1.1562 | C325: 1.1562 | D325: 0.01094365871679 | E325: 0.0109436577 | F325: of:=[.B325]-[.C325] -> 0 | G325: of:=[.D325]-[.E325] -> 0.00000000101679000115
A326: 01/10/1991 | B326: 1.2108 | C326: 1.2108 | D326: 0.00946519522297 | E326: 0.0094651944 | F326: of:=[.B326]-[.C326] -> 0 | G326: of:=[.D326]-[.E326] -> 0.00000000082296999944
A327: 01/11/1991 | B327: 1.2648 | C327: 1.2648 | D327: 0.00781730692349 | E327: 0.0078173062 | F327: of:=[.B327]-[.C327] -> 0 | G327: of:=[.D327]-[.E327] -> 0.00000000072348999881
A328: 01/12/1991 | B328: 1.2415 | C328: 1.2415 | D328: 0.00618066644805 | E328: 0.0061806659 | F328: of:=[.B328]-[.C328] -> 0 | G328: of:=[.D328]-[.E328] -> 0.00000000054805000035
A329: 01/01/1992 | B329: 1.2592 | C329: 1.2592 | D329: 0.00497838618449 | E329: 0.0049783857 | F329: of:=[.B329]-[.C329] -> 0 | G329: of:=[.D329]-[.E329] -> 0.0000000004844900002
A330: 01/02/1992 | B330: 1.2448 | C330: 1.2448 | D330: 0.00395361037523 | E330: 0.00395361 | F330: of:=[.B330]-[.C330] -> 0 | G330: of:=[.D330]-[.E330] -> 0.00000000037522999985
A331: 01/03/1992 | B331: 1.2162 | C331: 1.2162 | D331: 0.00317610087985 | E331: 0.0031761006 | F331: of:=[.B331]-[.C331] -> 0 | G331: of:=[.D331]-[.E331] -> 0.00000000027984999994
A332: 01/04/1992 | B332: 1.2084 | C332: 1.2084 | D332: 0.00261149554337 | E332: 0.0026114953 | F332: of:=[.B332]-[.C332] -> 0 | G332: of:=[.D332]-[.E332] -> 0.00000000024337000037
A333: 01/05/1992 | B333: 1.245 | C333: 1.245 | D333: 0.00216111845694 | E333: 0.0021611183 | F333: of:=[.B333]-[.C333] -> 0 | G333: of:=[.D333]-[.E333] -> 0.00000000015693999962
A334: 01/06/1992 | B334: 1.2085 | C334: 1.2085 | D334: 0.00173583811803 | E334: 0.001735838 | F334: of:=[.B334]-[.C334] -> 0 | G334: of:=[.D334]-[.E334] -> 0.00000000011803000005
A335: 01/07/1992 | B335: 1.2208 | C335: 1.2208 | D335: 0.0014363575656 | E335: 0.0014363574 | F335: of:=[.B335]-[.C335] -> 0 | G335: of:=[.D335]-[.E335] -> 0.00000000016560000008
A336: 01/08/1992 | B336: 1.2238 | C336: 1.2238 | D336: 0.00117657074508 | E336: 0.0011765706 | F336: of:=[.B336]-[.C336] -> 0 | G336: of:=[.D336]-[.E336] -> 0.00000000014507999988
A337: 01/09/1992 | B337: 1.2398 | C337: 1.2398 | D337: 0.00096140770149 | E337: 0.0009614076 | F337: of:=[.B337]-[.C337] -> 0 | G337: of:=[.D337]-[.E337] -> 0.00000000010149
A338: 01/10/1992 | B338: 1.2607 | C338: 1.2607 | D338: 0.00077545386473 | E338: 0.0007754538 | F338: of:=[.B338]-[.C338] -> 0 | G338: of:=[.D338]-[.E338] -> 0.00000000006473000001
A339: 01/11/1992 | B339: 1.2289 | C339: 1.2289 | D339: 0.00061509785415 | E339: 0.0006150978 | F339: of:=[.B339]-[.C339] -> 0 | G339: of:=[.D339]-[.E339] -> 0.00000000005414999991
A340: 01/12/1992 | B340: 1.2558 | C340: 1.2558 | D340: 0.00050052718216 | E340: 0.0005005271 | F340: of:=[.B340]-[.C340] -> 0 | G340: of:=[.D340]-[.E340] -> 0.00000000008216000005
A341: 01/01/1993 | B341: 1.2791 | C341: 1.2791 | D341: 0.00039857236993 | E341: 0.0003985723 | F341: of:=[.B341]-[.C341] -> 0 | G341: of:=[.D341]-[.E341] -> 0.00000000006993
A342: 01/02/1993 | B342: 1.2589 | C342: 1.2589 | D342: 0.0003116037604 | E342: 0.0003116037 | F342: of:=[.B342]-[.C342] -> 0 | G342: of:=[.D342]-[.E342] -> 0.0000000000604
A343: 01/03/1993 | B343: 1.2687 | C343: 1.2687 | D343: 0.00024752066121 | E343: 0.0002475206 | F343: of:=[.B343]-[.C343] -> 0 | G343: of:=[.D343]-[.E343] -> 0.00000000006121000001
A344: 01/04/1993 | B344: 1.2825 | C344: 1.2825 | D344: 0.00019509786491 | E344: 0.0001950978 | F344: of:=[.B344]-[.C344] -> 0 | G344: of:=[.D344]-[.E344] -> 0.00000000006490999998
A345: 01/05/1993 | B345: 1.2839 | C345: 1.2839 | D345: 0.00015212309155 | E345: 0.0001521231 | F345: of:=[.B345]-[.C345] -> 0 | G345: of:=[.D345]-[.E345] -> -0.00000000000845
A346: 01/06/1993 | B346: 1.3034 | C346: 1.3034 | D346: 0.00011848515581 | E346: 0.0001184851 | F346: of:=[.B346]-[.C346] -> 0 | G346: of:=[.D346]-[.E346] -> 0.00000000005581
A347: 01/07/1993 | B347: 1.2926 | C347: 1.2926 | D347: 0.00009090467686 | E347: 0.0000909047 | F347: of:=[.B347]-[.C347] -> 0 | G347: of:=[.D347]-[.E347] -> -0.00000000002314000001
A348: 01/08/1993 | B348: 1.3222 | C348: 1.3222 | D348: 0.07032699741244 | E348: 0.070326991 | F348: of:=[.B348]-[.C348] -> 0 | G348: of:=[.D348]-[.E348] -> 0.00000000641243999566
A349: 01/09/1993 | B349: 1.3517 | C349: 1.3517 | D349: 0.05318937937713 | E349: 0.0531893745 | F349: of:=[.B349]-[.C349] -> 0 | G349: of:=[.D349]-[.E349] -> 0.00000000487713000541
A350: 01/10/1993 | B350: 1.3492 | C350: 1.3492 | D350: 0.03934998844206 | E350: 0.0393499849 | F350: of:=[.B350]-[.C350] -> 0 | G350: of:=[.D350]-[.E350] -> 0.00000000354205999947
A351: 01/11/1993 | B351: 1.3489 | C351: 1.3489 | D351: 0.02916542280022 | E351: 0.0291654201 | F351: of:=[.B351]-[.C351] -> 0 | G351: of:=[.D351]-[.E351] -> 0.00000000270022000246
A352: 01/12/1993 | B352: 1.3735 | C352: 1.3735 | D352: 0.02162163451718 | E352: 0.0216216326 | F352: of:=[.B352]-[.C352] -> 0 | G352: of:=[.D352]-[.E352] -> 0.00000000191718000156
A353: 01/01/1994 | B353: 1.4025 | C353: 1.4025 | D353: 0.01574199819234 | E353: 0.0157419968 | F353: of:=[.B353]-[.C353] -> 0 | G353: of:=[.D353]-[.E353] -> 0.00000000139234000024
A354: 01/02/1994 | B354: 1.3967 | C354: 1.3967 | D354: 0.01122424113536 | E354: 0.0112242401 | F354: of:=[.B354]-[.C354] -> 0 | G354: of:=[.D354]-[.E354] -> 0.00000000103536000086
A355: 01/03/1994 | B355: 1.46015 | C355: 1.46015 | D355: 0.00803625770413 | E355: 0.008036257 | F355: of:=[.B355]-[.C355] -> 0 | G355: of:=[.D355]-[.E355] -> 0.00000000070413000083
A356: 01/04/1994 | B356: 1.4219644487 | C356: 1.4219644487 | D356: 0.00550372064797 | E356: 0.0055037201 | F356: of:=[.B356]-[.C356] -> 0 | G356: of:=[.D356]-[.E356] -> 0.0000000005479700001
A357: 01/05/1994 | B357: 1.4416278929 | C357: 1.4416278929 | D357: 0.00387050509807 | E357: 0.0038705047 | F357: of:=[.B357]-[.C357] -> 0 | G357: of:=[.D357]-[.E357] -> 0.00000000039806999971
A358: 01/06/1994 | B358: 0.0005239443 | C358: 0.0005239443 | D358: 0.00268481562901 | E358: 0.0026848154 | F358: of:=[.B358]-[.C358] -> 0 | G358: of:=[.D358]-[.E358] -> 0.0000000002290100002
A359: 01/07/1994 | B359: 1.0608 | C359: 1.0608 | D359: 5.12423864332632 | E359: 5.1242386433 | F359: of:=[.B359]-[.C359] -> 0 | G359: of:=[.D359]-[.E359] -> 0.00000000002632027929
A360: 01/08/1994 | B360: 1.0546 | C360: 1.0546 | D360: 4.83054170750973 | E360: 4.8305417075 | F360: of:=[.B360]-[.C360] -> 0 | G360: of:=[.D360]-[.E360] -> 0.00000000000972999459
A361: 01/09/1994 | B361: 1.0151 | C361: 1.0151 | D361: 4.5804491821636 | E361: 4.5804491822 | F361: of:=[.B361]-[.C361] -> 0 | G361: of:=[.D361]-[.E361] -> -0.000000000036399328
A362: 01/10/1994 | B362: 1.0186 | C362: 1.0186 | D362: 4.51231325205753 | E362: 4.5123132521 | F362: of:=[.B362]-[.C362] -> 0 | G362: of:=[.D362]-[.E362] -> -0.00000000004247002749
A363: 01/11/1994 | B363: 1.0327 | C363: 1.0327 | D363: 4.42991679958524 | E363: 4.4299167996 | F363: of:=[.B363]-[.C363] -> 0 | G363: of:=[.D363]-[.E363] -> -0.00000000001475974898
A364: 01/12/1994 | B364: 1.0219 | C364: 1.0219 | D364: 4.2896453951634 | E364: 4.2896453952 | F364: of:=[.B364]-[.C364] -> 0 | G364: of:=[.D364]-[.E364] -> -0.00000000003660005632
A365: 01/01/1995 | B365: 1.0167 | C365: 1.0167 | D365: 4.19771542730541 | E365: 4.1977154273 | F365: of:=[.B365]-[.C365] -> 0 | G365: of:=[.D365]-[.E365] -> 0.00000000000540989475
A366: 01/02/1995 | B366: 1.0099 | C366: 1.0099 | D366: 4.12876505095447 | E366: 4.128765051 | F366: of:=[.B366]-[.C366] -> 0 | G366: of:=[.D366]-[.E366] -> -0.00000000004552980215
A367: 01/03/1995 | B367: 1.0141 | C367: 1.0141 | D367: 4.08829097034802 | E367: 4.0882909703 | F367: of:=[.B367]-[.C367] -> 0 | G367: of:=[.D367]-[.E367] -> 0.00000000004802025444
A368: 01/04/1995 | B368: 1.0192 | C368: 1.0192 | D368: 4.03144755975547 | E368: 4.0314475598 | F368: of:=[.B368]-[.C368] -> 0 | G368: of:=[.D368]-[.E368] -> -0.00000000004452971325
A369: 01/05/1995 | B369: 1.0257 | C369: 1.0257 | D369: 3.955501922837 | E369: 3.9555019228 | F369: of:=[.B369]-[.C369] -> 0 | G369: of:=[.D369]-[.E369] -> 0.0000000000370001807
A370: 01/06/1995 | B370: 1.0182 | C370: 1.0182 | D370: 3.85639263218972 | E370: 3.8563926322 | F370: of:=[.B370]-[.C370] -> 0 | G370: of:=[.D370]-[.E370] -> -0.00000000001027977703
A371: 01/07/1995 | B371: 1.0246 | C371: 1.0246 | D371: 3.7874608448141 | E371: 3.7874608448 | F371: of:=[.B371]-[.C371] -> 0 | G371: of:=[.D371]-[.E371] -> 0.00000000001409983241
A372: 01/08/1995 | B372: 1.0102 | C372: 1.0102 | D372: 3.6965262978861 | E372: 3.6965262979 | F372: of:=[.B372]-[.C372] -> 0 | G372: of:=[.D372]-[.E372] -> -0.00000000001389999227
A373: 01/09/1995 | B373: 1.0117 | C373: 1.0117 | D373: 3.6592024330688 | E373: 3.6592024331 | F373: of:=[.B373]-[.C373] -> 0 | G373: of:=[.D373]-[.E373] -> -0.00000000003119993153
A374: 01/10/1995 | B374: 1.014 | C374: 1.014 | D374: 3.61688487997311 | E374: 3.61688488 | F374: of:=[.B374]-[.C374] -> 0 | G374: of:=[.D374]-[.E374] -> -0.00000000002689004575
A375: 01/11/1995 | B375: 1.0151 | C375: 1.0151 | D375: 3.56694761338571 | E375: 3.5669476134 | F375: of:=[.B375]-[.C375] -> 0 | G375: of:=[.D375]-[.E375] -> -0.00000000001428990259
A376: 01/12/1995 | B376: 1.0165 | C376: 1.0165 | D376: 3.51388790600503 | E376: 3.513887906 | F376: of:=[.B376]-[.C376] -> 0 | G376: of:=[.D376]-[.E376] -> 0.00000000000503019848
A377: 01/01/1996 | B377: 1.0146 | C377: 1.0146 | D377: 3.45684988293658 | E377: 3.4568498829 | F377: of:=[.B377]-[.C377] -> 0 | G377: of:=[.D377]-[.E377] -> 0.0000000000365800723
A378: 01/02/1996 | B378: 1.0071 | C378: 1.0071 | D378: 3.4071061333891 | E378: 3.4071061334 | F378: of:=[.B378]-[.C378] -> 0 | G378: of:=[.D378]-[.E378] -> -0.00000000001090016966
A379: 01/03/1996 | B379: 1.0029 | C379: 1.0029 | D379: 3.38308622121845 | E379: 3.3830862212 | F379: of:=[.B379]-[.C379] -> 0 | G379: of:=[.D379]-[.E379] -> 0.00000000001844968622
A380: 01/04/1996 | B380: 1.0093 | C380: 1.0093 | D380: 3.37330364066053 | E380: 3.3733036407 | F380: of:=[.B380]-[.C380] -> 0 | G380: of:=[.D380]-[.E380] -> -0.00000000003947020488
A381: 01/05/1996 | B381: 1.0168 | C381: 1.0168 | D381: 3.34222098549542 | E381: 3.3422209855 | F381: of:=[.B381]-[.C381] -> 0 | G381: of:=[.D381]-[.E381] -> -0.00000000000457989202
A382: 01/06/1996 | B382: 1.0122 | C382: 1.0122 | D382: 3.28699939564852 | E382: 3.2869993956 | F382: of:=[.B382]-[.C382] -> 0 | G382: of:=[.D382]-[.E382] -> 0.0000000000485198548
A383: 01/07/1996 | B383: 1.0109 | C383: 1.0109 | D383: 3.24738134326074 | E383: 3.2473813433 | F383: of:=[.B383]-[.C383] -> 0 | G383: of:=[.D383]-[.E383] -> -0.0000000000392597066
A384: 01/08/1996 | B384: 1 | C384: 1 | D384: 3.21236654788875 | E384: 3.2123665479 | F384: of:=[.B384]-[.C384] -> 0 | G384: of:=[.D384]-[.E384] -> -0.00000000001124966786
A385: 01/09/1996 | B385: 1.0013 | C385: 1.0013 | D385: 3.21236654788875 | E385: 3.2123665479 | F385: of:=[.B385]-[.C385] -> 0 | G385: of:=[.D385]-[.E385] -> -0.00000000001124966786
A386: 01/10/1996 | B386: 1.0022 | C386: 1.0022 | D386: 3.20819589322755 | E386: 3.2081958932 | F386: of:=[.B386]-[.C386] -> 0 | G386: of:=[.D386]-[.E386] -> 0.00000000002754996231
A387: 01/11/1996 | B387: 1.0028 | C387: 1.0028 | D387: 3.20115335584469 | E387: 3.2011533558 | F387: of:=[.B387]-[.C387] -> 0 | G387: of:=[.D387]-[.E387] -> 0.00000000004469002945
A388: 01/12/1996 | B388: 1.0088 | C388: 1.0088 | D388: 3.19221515341513 | E388: 3.1922151534 | F388: of:=[.B388]-[.C388] -> 0 | G388: of:=[.D388]-[.E388] -> 0.00000000001513011938
A389: 01/01/1997 | B389: 1.0158 | C389: 1.0158 | D389: 3.16436870877788 | E389: 3.1643687088 | F389: of:=[.B389]-[.C389] -> 0 | G389: of:=[.D389]-[.E389] -> -0.00000000002212008354
A390: 01/02/1997 | B390: 1.0042 | C390: 1.0042 | D390: 3.11514934906269 | E390: 3.1151493491 | F390: of:=[.B390]-[.C390] -> 0 | G390: of:=[.D390]-[.E390] -> -0.00000000003731015497
A391: 01/03/1997 | B391: 1.0116 | C391: 1.0116 | D391: 3.10212044320124 | E391: 3.1021204432 | F391: of:=[.B391]-[.C391] -> 0 | G391: of:=[.D391]-[.E391] -> 0.00000000000123989707
A392: 01/04/1997 | B392: 1.0059 | C392: 1.0059 | D392: 3.06654848082369 | E392: 3.0665484808 | F392: of:=[.B392]-[.C392] -> 0 | G392: of:=[.D392]-[.E392] -> 0.0000000000236899389
A393: 01/05/1997 | B393: 1.003 | C393: 1.003 | D393: 3.04856196522884 | E393: 3.0485619652 | F393: of:=[.B393]-[.C393] -> 0 | G393: of:=[.D393]-[.E393] -> 0.00000000002884004147
A394: 01/06/1997 | B394: 1.007 | C394: 1.007 | D394: 3.03944363432586 | E394: 3.0394436343 | F394: of:=[.B394]-[.C394] -> 0 | G394: of:=[.D394]-[.E394] -> 0.00000000002586020287
A395: 01/07/1997 | B395: 1.0009 | C395: 1.0009 | D395: 3.01831542634147 | E395: 3.0183154263 | F395: of:=[.B395]-[.C395] -> 0 | G395: of:=[.D395]-[.E395] -> 0.00000000004146993859
A396: 01/08/1997 | B396: 0.9996 | C396: 0.9996 | D396: 3.01560138509488 | E396: 3.0156013851 | F396: of:=[.B396]-[.C396] -> 0 | G396: of:=[.D396]-[.E396] -> -0.0000000000051199045
A397: 01/09/1997 | B397: 1.0059 | C397: 1.0059 | D397: 3.01680810833822 | E397: 3.0168081083 | F397: of:=[.B397]-[.C397] -> 0 | G397: of:=[.D397]-[.E397] -> 0.00000000003822009376
A398: 01/10/1997 | B398: 1.0034 | C398: 1.0034 | D398: 2.99911333963438 | E398: 2.9991133396 | F398: of:=[.B398]-[.C398] -> 0 | G398: of:=[.D398]-[.E398] -> 0.00000000003438005436
A399: 01/11/1997 | B399: 1.0083 | C399: 1.0083 | D399: 2.9889509065521 | E399: 2.9889509066 | F399: of:=[.B399]-[.C399] -> 0 | G399: of:=[.D399]-[.E399] -> -0.00000000004789990626
A400: 01/12/1997 | B400: 1.0069 | C400: 1.0069 | D400: 2.96434682788069 | E400: 2.9643468279 | F400: of:=[.B400]-[.C400] -> 0 | G400: of:=[.D400]-[.E400] -> -0.00000000001930988702
A401: 01/01/1998 | B401: 1.0088 | C401: 1.0088 | D401: 2.94403300017945 | E401: 2.9440330002 | F401: of:=[.B401]-[.C401] -> 0 | G401: of:=[.D401]-[.E401] -> -0.00000000002055022819
A402: 01/02/1998 | B402: 1.0002 | C402: 1.0002 | D402: 2.91835150691857 | E402: 2.9183515069 | F402: of:=[.B402]-[.C402] -> 0 | G402: of:=[.D402]-[.E402] -> 0.0000000000185700344
A403: 01/03/1998 | B403: 1.0023 | C403: 1.0023 | D403: 2.9177679533279 | E403: 2.9177679533 | F403: of:=[.B403]-[.C403] -> 0 | G403: of:=[.D403]-[.E403] -> 0.0000000000279003487
A404: 01/04/1998 | B404: 0.9987 | C404: 0.9987 | D404: 2.9110724866087 | E404: 2.9110724866 | F404: of:=[.B404]-[.C404] -> 0 | G404: of:=[.D404]-[.E404] -> 0.00000000000869970762
A405: 01/05/1998 | B405: 1.0023 | C405: 1.0023 | D405: 2.91486180695775 | E405: 2.914861807 | F405: of:=[.B405]-[.C405] -> 0 | G405: of:=[.D405]-[.E405] -> -0.00000000004224975925
A406: 01/06/1998 | B406: 1.0028 | C406: 1.0028 | D406: 2.90817300903696 | E406: 2.908173009 | F406: of:=[.B406]-[.C406] -> 0 | G406: of:=[.D406]-[.E406] -> 0.00000000003696021267
A407: 01/07/1998 | B407: 0.9962 | C407: 0.9962 | D407: 2.90005286102609 | E407: 2.900052861 | F407: of:=[.B407]-[.C407] -> 0 | G407: of:=[.D407]-[.E407] -> 0.00000000002609024108
A408: 01/08/1998 | B408: 0.9983 | C408: 0.9983 | D408: 2.91111509840001 | E408: 2.9111150984 | F408: of:=[.B408]-[.C408] -> 0 | G408: of:=[.D408]-[.E408] -> 0
A409: 01/09/1998 | B409: 0.9998 | C409: 0.9998 | D409: 2.91607242151659 | E409: 2.9160724215 | F409: of:=[.B409]-[.C409] -> 0 | G409: of:=[.D409]-[.E409] -> 0.00000000001658984061
A410: 01/10/1998 | B410: 0.9997 | C410: 0.9997 | D410: 2.91665575266712 | E410: 2.9166557527 | F410: of:=[.B410]-[.C410] -> 0 | G410: of:=[.D410]-[.E410] -> -0.00000000003287992101
A411: 01/11/1998 | B411: 0.9982 | C411: 0.9982 | D411: 2.91753101197071 | E411: 2.917531012 | F411: of:=[.B411]-[.C411] -> 0 | G411: of:=[.D411]-[.E411] -> -0.00000000002928990384
A412: 01/12/1998 | B412: 1.0098 | C412: 1.0098 | D412: 2.92279203763846 | E412: 2.9227920376 | F412: of:=[.B412]-[.C412] -> 0 | G412: of:=[.D412]-[.E412] -> 0.00000000003846034602
A413: 01/01/1999 | B413: 1.0115 | C413: 1.0115 | D413: 2.89442665640568 | E413: 2.8944266564 | F413: of:=[.B413]-[.C413] -> 0 | G413: of:=[.D413]-[.E413] -> 0.00000000000568034508
A414: 01/02/1999 | B414: 1.0444 | C414: 1.0444 | D414: 2.86151918576933 | E414: 2.8615191858 | F414: of:=[.B414]-[.C414] -> 0 | G414: of:=[.D414]-[.E414] -> -0.0000000000306701331
A415: 01/03/1999 | B415: 1.0198 | C415: 1.0198 | D415: 2.73986900207711 | E415: 2.7398690021 | F415: of:=[.B415]-[.C415] -> 0 | G415: of:=[.D415]-[.E415] -> -0.00000000002288969014
A416: 01/04/1999 | B416: 1.0003 | C416: 1.0003 | D416: 2.68667287907149 | E416: 2.6866728791 | F416: of:=[.B416]-[.C416] -> 0 | G416: of:=[.D416]-[.E416] -> -0.00000000002851008318
A417: 01/05/1999 | B417: 0.9966 | C417: 0.9966 | D417: 2.68586711893581 | E417: 2.6858671189 | F417: of:=[.B417]-[.C417] -> 0 | G417: of:=[.D417]-[.E417] -> 0.00000000003581002161
A418: 01/06/1999 | B418: 1.0102 | C418: 1.0102 | D418: 2.69503022168955 | E418: 2.6950302217 | F418: of:=[.B418]-[.C418] -> 0 | G418: of:=[.D418]-[.E418] -> -0.00000000001045030729
A419: 01/07/1999 | B419: 1.0159 | C419: 1.0159 | D419: 2.66781847326227 | E419: 2.6678184733 | F419: of:=[.B419]-[.C419] -> 0 | G419: of:=[.D419]-[.E419] -> -0.00000000003773026336
A420: 01/08/1999 | B420: 1.0145 | C420: 1.0145 | D420: 2.62606405479109 | E420: 2.6260640548 | F420: of:=[.B420]-[.C420] -> 0 | G420: of:=[.D420]-[.E420] -> -0.00000000000891020591
A421: 01/09/1999 | B421: 1.0147 | C421: 1.0147 | D421: 2.58853036450576 | E421: 2.5885303645 | F421: of:=[.B421]-[.C421] -> 0 | G421: of:=[.D421]-[.E421] -> 0.00000000000575983705
A422: 01/10/1999 | B422: 1.0189 | C422: 1.0189 | D422: 2.55103022026782 | E422: 2.5510302203 | F422: of:=[.B422]-[.C422] -> 0 | G422: of:=[.D422]-[.E422] -> -0.00000000003218003641
A423: 01/11/1999 | B423: 1.0253 | C423: 1.0253 | D423: 2.50371009938936 | E423: 2.5037100994 | F423: of:=[.B423]-[.C423] -> 0 | G423: of:=[.D423]-[.E423] -> -0.00000000001063993338
A424: 01/12/1999 | B424: 1.0123 | C424: 1.0123 | D424: 2.44192928839302 | E424: 2.4419292884 | F424: of:=[.B424]-[.C424] -> 0 | G424: of:=[.D424]-[.E424] -> -0.00000000000697975011
A425: 01/01/2000 | B425: 1.0102 | C425: 1.0102 | D425: 2.41225850873557 | E425: 2.4122585087 | F425: of:=[.B425]-[.C425] -> 0 | G425: of:=[.D425]-[.E425] -> 0.00000000003557021344
A426: 01/02/2000 | B426: 1.0019 | C426: 1.0019 | D426: 2.38790190926111 | E426: 2.3879019093 | F426: of:=[.B426]-[.C426] -> 0 | G426: of:=[.D426]-[.E426] -> -0.00000000003889022437
A427: 01/03/2000 | B427: 1.0018 | C427: 1.0018 | D427: 2.38337349961185 | E427: 2.3833734996 | F427: of:=[.B427]-[.C427] -> 0 | G427: of:=[.D427]-[.E427] -> 0.00000000001185007648
A428: 01/04/2000 | B428: 1.0013 | C428: 1.0013 | D428: 2.37909113556783 | E428: 2.3790911356 | F428: of:=[.B428]-[.C428] -> 0 | G428: of:=[.D428]-[.E428] -> -0.00000000003216982236
A429: 01/05/2000 | B429: 1.0067 | C429: 1.0067 | D429: 2.37600233253553 | E429: 2.3760023325 | F429: of:=[.B429]-[.C429] -> 0 | G429: of:=[.D429]-[.E429] -> 0.00000000003552980132
A430: 01/06/2000 | B430: 1.0093 | C430: 1.0093 | D430: 2.36018906579471 | E430: 2.3601890658 | F430: of:=[.B430]-[.C430] -> 0 | G430: of:=[.D430]-[.E430] -> -0.00000000000528999067
A431: 01/07/2000 | B431: 1.0226 | C431: 1.0226 | D431: 2.33844155929328 | E431: 2.3384415593 | F431: of:=[.B431]-[.C431] -> 0 | G431: of:=[.D431]-[.E431] -> -0.00000000000671995792
A432: 01/08/2000 | B432: 1.0182 | C432: 1.0182 | D432: 2.28676076598208 | E432: 2.286760766 | F432: of:=[.B432]-[.C432] -> 0 | G432: of:=[.D432]-[.E432] -> -0.0000000000179198878
A433: 01/09/2000 | B433: 1.0069 | C433: 1.0069 | D433: 2.24588564720299 | E433: 2.2458856472 | F433: of:=[.B433]-[.C433] -> 0 | G433: of:=[.D433]-[.E433] -> 0.00000000000299005265
A434: 01/10/2000 | B434: 1.0037 | C434: 1.0037 | D434: 2.2304952301152 | E434: 2.2304952301 | F434: of:=[.B434]-[.C434] -> 0 | G434: of:=[.D434]-[.E434] -> 0.00000000001520028547
A435: 01/11/2000 | B435: 1.0039 | C435: 1.0039 | D435: 2.22227282067869 | E435: 2.2222728207 | F435: of:=[.B435]-[.C435] -> 0 | G435: of:=[.D435]-[.E435] -> -0.00000000002131006482
A436: 01/12/2000 | B436: 1.0076 | C436: 1.0076 | D436: 2.21363962613676 | E436: 2.2136396261 | F436: of:=[.B436]-[.C436] -> 0 | G436: of:=[.D436]-[.E436] -> 0.00000000003675992843
A437: 01/01/2001 | B437: 1.0049 | C437: 1.0049 | D437: 2.19694286039774 | E437: 2.1969428604 | F437: of:=[.B437]-[.C437] -> 0 | G437: of:=[.D437]-[.E437] -> -0.00000000000225996999
A438: 01/02/2001 | B438: 1.0034 | C438: 1.0034 | D438: 2.18623033177206 | E438: 2.1862303318 | F438: of:=[.B438]-[.C438] -> 0 | G438: of:=[.D438]-[.E438] -> -0.00000000002793987264
A439: 01/03/2001 | B439: 1.008 | C439: 1.008 | D439: 2.17882233583024 | E439: 2.1788223358 | F439: of:=[.B439]-[.C439] -> 0 | G439: of:=[.D439]-[.E439] -> 0.00000000003023981066
A440: 01/04/2001 | B440: 1.0113 | C440: 1.0113 | D440: 2.16153009506968 | E440: 2.1615300951 | F440: of:=[.B440]-[.C440] -> 0 | G440: of:=[.D440]-[.E440] -> -0.00000000003031974671
A441: 01/05/2001 | B441: 1.0044 | C441: 1.0044 | D441: 2.13737772675732 | E441: 2.1373777268 | F441: of:=[.B441]-[.C441] -> 0 | G441: of:=[.D441]-[.E441] -> -0.00000000004268008169
A442: 01/06/2001 | B442: 1.0146 | C442: 1.0146 | D442: 2.12801446311959 | E442: 2.1280144631 | F442: of:=[.B442]-[.C442] -> 0 | G442: of:=[.D442]-[.E442] -> 0.00000000001959010731
A443: 01/07/2001 | B443: 1.0162 | C443: 1.0162 | D443: 2.0973925321502 | E443: 2.0973925322 | F443: of:=[.B443]-[.C443] -> 0 | G443: of:=[.D443]-[.E443] -> -0.00000000004980016399
A444: 01/08/2001 | B444: 1.009 | C444: 1.009 | D444: 2.06395643785692 | E444: 2.0639564379 | F444: of:=[.B444]-[.C444] -> 0 | G444: of:=[.D444]-[.E444] -> -0.00000000004307976198
A445: 01/09/2001 | B445: 1.0038 | C445: 1.0038 | D445: 2.04554651918426 | E445: 2.0455465192 | F445: of:=[.B445]-[.C445] -> 0 | G445: of:=[.D445]-[.E445] -> -0.00000000001574029795
A446: 01/10/2001 | B446: 1.0145 | C446: 1.0145 | D446: 2.03780286828478 | E446: 2.0378028683 | F446: of:=[.B446]-[.C446] -> 0 | G446: of:=[.D446]-[.E446] -> -0.0000000000152198254
A447: 01/11/2001 | B447: 1.0076 | C447: 1.0076 | D447: 2.00867705104463 | E447: 2.008677051 | F447: of:=[.B447]-[.C447] -> 0 | G447: of:=[.D447]-[.E447] -> 0.00000000004463007741
A448: 01/12/2001 | B448: 1.0018 | C448: 1.0018 | D448: 1.99352625153298 | E448: 1.9935262515 | F448: of:=[.B448]-[.C448] -> 0 | G448: of:=[.D448]-[.E448] -> 0.00000000003297984108
A449: 01/01/2002 | B449: 1.0019 | C449: 1.0019 | D449: 1.98994435169992 | E449: 1.9899443517 | F449: of:=[.B449]-[.C449] -> 0 | G449: of:=[.D449]-[.E449] -> -0.00000000000007993606
A450: 01/02/2002 | B450: 1.0018 | C450: 1.0018 | D450: 1.98617062750766 | E450: 1.9861706275 | F450: of:=[.B450]-[.C450] -> 0 | G450: of:=[.D450]-[.E450] -> 0.00000000000766009478
A451: 01/03/2002 | B451: 1.0011 | C451: 1.0011 | D451: 1.98260194400844 | E451: 1.982601944 | F451: of:=[.B451]-[.C451] -> 0 | G451: of:=[.D451]-[.E451] -> 0.00000000000843991543
A452: 01/04/2002 | B452: 1.007 | C452: 1.007 | D452: 1.98042347818244 | E452: 1.9804234782 | F452: of:=[.B452]-[.C452] -> 0 | G452: of:=[.D452]-[.E452] -> -0.00000000001756017554
A453: 01/05/2002 | B453: 1.0111 | C453: 1.0111 | D453: 1.96665688002228 | E453: 1.96665688 | F453: of:=[.B453]-[.C453] -> 0 | G453: of:=[.D453]-[.E453] -> 0.00000000002227995566
A454: 01/06/2002 | B454: 1.0174 | C454: 1.0174 | D454: 1.94506664031479 | E454: 1.9450666403 | F454: of:=[.B454]-[.C454] -> 0 | G454: of:=[.D454]-[.E454] -> 0.00000000001478994704
A455: 01/07/2002 | B455: 1.0205 | C455: 1.0205 | D455: 1.91180129773421 | E455: 1.9118012977 | F455: of:=[.B455]-[.C455] -> 0 | G455: of:=[.D455]-[.E455] -> 0.00000000003420996819
A456: 01/08/2002 | B456: 1.0236 | C456: 1.0236 | D456: 1.87339666607958 | E456: 1.8733966661 | F456: of:=[.B456]-[.C456] -> 0 | G456: of:=[.D456]-[.E456] -> -0.00000000002042011005
A457: 01/09/2002 | B457: 1.0264 | C457: 1.0264 | D457: 1.83020385509924 | E457: 1.8302038551 | F457: of:=[.B457]-[.C457] -> 0 | G457: of:=[.D457]-[.E457] -> -0.00000000000075983664
A458: 01/10/2002 | B458: 1.0421 | C458: 1.0421 | D458: 1.78312924308188 | E458: 1.7831292431 | F458: of:=[.B458]-[.C458] -> 0 | G458: of:=[.D458]-[.E458] -> -0.00000000001812017203
A459: 01/11/2002 | B459: 1.0584 | C459: 1.0584 | D459: 1.71109225897887 | E459: 1.711092259 | F459: of:=[.B459]-[.C459] -> 0 | G459: of:=[.D459]-[.E459] -> -0.00000000002112998665
A460: 01/12/2002 | B460: 1.027 | C460: 1.027 | D460: 1.61667824922418 | E460: 1.6166782492 | F460: of:=[.B460]-[.C460] -> 0 | G460: of:=[.D460]-[.E460] -> 0.00000000002417999134
A461: 01/01/2003 | B461: 1.0217 | C461: 1.0217 | D461: 1.57417551044224 | E461: 1.5741755104 | F461: of:=[.B461]-[.C461] -> 0 | G461: of:=[.D461]-[.E461] -> 0.00000000004223998928
A462: 01/02/2003 | B462: 1.0159 | C462: 1.0159 | D462: 1.54074142159366 | E462: 1.5407414216 | F462: of:=[.B462]-[.C462] -> 0 | G462: of:=[.D462]-[.E462] -> -0.0000000000063400396
A463: 01/03/2003 | B463: 1.0166 | C463: 1.0166 | D463: 1.5166270514752 | E463: 1.5166270515 | F463: of:=[.B463]-[.C463] -> 0 | G463: of:=[.D463]-[.E463] -> -0.00000000002479993988
A464: 01/04/2003 | B464: 1.0041 | C464: 1.0041 | D464: 1.491862139952 | E464: 1.49186214 | F464: of:=[.B464]-[.C464] -> 0 | G464: of:=[.D464]-[.E464] -> -0.00000000004800004838
A465: 01/05/2003 | B465: 0.9933 | C465: 0.9933 | D465: 1.48577048097998 | E465: 1.485770481 | F465: of:=[.B465]-[.C465] -> 0 | G465: of:=[.D465]-[.E465] -> -0.00000000002001998567
A466: 01/06/2003 | B466: 0.993 | C466: 0.993 | D466: 1.49579228931841 | E466: 1.4957922893 | F466: of:=[.B466]-[.C466] -> 0 | G466: of:=[.D466]-[.E466] -> 0.00000000001840994024
A467: 01/07/2003 | B467: 0.998 | C467: 0.998 | D467: 1.50633664583929 | E467: 1.5063366458 | F467: of:=[.B467]-[.C467] -> 0 | G467: of:=[.D467]-[.E467] -> 0.00000000003928990466
A468: 01/08/2003 | B468: 1.0062 | C468: 1.0062 | D468: 1.50935535655239 | E468: 1.5093553566 | F468: of:=[.B468]-[.C468] -> 0 | G468: of:=[.D468]-[.E468] -> -0.00000000004760991601
A469: 01/09/2003 | B469: 1.0105 | C469: 1.0105 | D469: 1.50005501545656 | E469: 1.5000550155 | F469: of:=[.B469]-[.C469] -> 0 | G469: of:=[.D469]-[.E469] -> -0.00000000004344014037
A470: 01/10/2003 | B470: 1.0044 | C470: 1.0044 | D470: 1.48446810040234 | E470: 1.4844681004 | F470: of:=[.B470]-[.C470] -> 0 | G470: of:=[.D470]-[.E470] -> 0.00000000000233990605
A471: 01/11/2003 | B471: 1.0048 | C471: 1.0048 | D471: 1.47796505416402 | E471: 1.4779650542 | F471: of:=[.B471]-[.C471] -> 0 | G471: of:=[.D471]-[.E471] -> -0.00000000003598010778
A472: 01/12/2003 | B472: 1.006 | C472: 1.006 | D472: 1.47090471154859 | E472: 1.4709047115 | F472: of:=[.B472]-[.C472] -> 0 | G472: of:=[.D472]-[.E472] -> 0.0000000000485900209
A473: 01/01/2004 | B473: 1.008 | C473: 1.008 | D473: 1.46213192002842 | E473: 1.46213192 | F473: of:=[.B473]-[.C473] -> 0 | G473: of:=[.D473]-[.E473] -> 0.00000000002841993307
A474: 01/02/2004 | B474: 1.0108 | C474: 1.0108 | D474: 1.45052769844089 | E474: 1.4505276984 | F474: of:=[.B474]-[.C474] -> 0 | G474: of:=[.D474]-[.E474] -> 0.00000000004088995809
A475: 01/03/2004 | B475: 1.0093 | C475: 1.0093 | D475: 1.43502938112474 | E475: 1.4350293811 | F475: of:=[.B475]-[.C475] -> 0 | G475: of:=[.D475]-[.E475] -> 0.00000000002474020988
A476: 01/04/2004 | B476: 1.0115 | C476: 1.0115 | D476: 1.42180657993138 | E476: 1.4218065799 | F476: of:=[.B476]-[.C476] -> 0 | G476: of:=[.D476]-[.E476] -> 0.0000000000313800097
A477: 01/05/2004 | B477: 1.0146 | C477: 1.0146 | D477: 1.40564170037704 | E477: 1.4056417004 | F477: of:=[.B477]-[.C477] -> 0 | G477: of:=[.D477]-[.E477] -> -0.00000000002295985624
A478: 01/06/2004 | B478: 1.0129 | C478: 1.0129 | D478: 1.38541464653759 | E478: 1.3854146465 | F478: of:=[.B478]-[.C478] -> 0 | G478: of:=[.D478]-[.E478] -> 0.00000000003759015321
A479: 01/07/2004 | B479: 1.0114 | C479: 1.0114 | D479: 1.3677704082709 | E479: 1.3677704083 | F479: of:=[.B479]-[.C479] -> 0 | G479: of:=[.D479]-[.E479] -> -0.0000000000291000557
A480: 01/08/2004 | B480: 1.0131 | C480: 1.0131 | D480: 1.35235357748754 | E480: 1.3523535775 | F480: of:=[.B480]-[.C480] -> 0 | G480: of:=[.D480]-[.E480] -> -0.00000000001246003301
A481: 01/09/2004 | B481: 1.0048 | C481: 1.0048 | D481: 1.3348668221178 | E481: 1.3348668221 | F481: of:=[.B481]-[.C481] -> 0 | G481: of:=[.D481]-[.E481] -> 0.00000000001779998371
A482: 01/10/2004 | B482: 1.0053 | C482: 1.0053 | D482: 1.32849006978284 | E482: 1.3284900698 | F482: of:=[.B482]-[.C482] -> 0 | G482: of:=[.D482]-[.E482] -> -0.00000000001716005116
A483: 01/11/2004 | B483: 1.0082 | C483: 1.0082 | D483: 1.32148619296015 | E483: 1.321486193 | F483: of:=[.B483]-[.C483] -> 0 | G483: of:=[.D483]-[.E483] -> -0.00000000003984990116
A484: 01/12/2004 | B484: 1.0052 | C484: 1.0052 | D484: 1.31073814021042 | E484: 1.3107381402 | F484: of:=[.B484]-[.C484] -> 0 | G484: of:=[.D484]-[.E484] -> 0.00000000001041988718
A485: 01/01/2005 | B485: 1.0033 | C485: 1.0033 | D485: 1.30395756089377 | E485: 1.3039575609 | F485: of:=[.B485]-[.C485] -> 0 | G485: of:=[.D485]-[.E485] -> -0.00000000000623012752
A486: 01/02/2005 | B486: 1.004 | C486: 1.004 | D486: 1.29966865433447 | E486: 1.2996686543 | F486: of:=[.B486]-[.C486] -> 0 | G486: of:=[.D486]-[.E486] -> 0.00000000003446998242
A487: 01/03/2005 | B487: 1.0099 | C487: 1.0099 | D487: 1.2944906915682 | E487: 1.2944906916 | F487: of:=[.B487]-[.C487] -> 0 | G487: of:=[.D487]-[.E487] -> -0.00000000003180011809
A488: 01/04/2005 | B488: 1.0051 | C488: 1.0051 | D488: 1.28180086302426 | E488: 1.281800863 | F488: of:=[.B488]-[.C488] -> 0 | G488: of:=[.D488]-[.E488] -> 0.00000000002426014944
A489: 01/05/2005 | B489: 0.9975 | C489: 0.9975 | D489: 1.27529684909388 | E489: 1.2752968491 | F489: of:=[.B489]-[.C489] -> 0 | G489: of:=[.D489]-[.E489] -> -0.0000000000061199934
A490: 01/06/2005 | B490: 0.9955 | C490: 0.9955 | D490: 1.27849308179838 | E490: 1.2784930818 | F490: of:=[.B490]-[.C490] -> 0 | G490: of:=[.D490]-[.E490] -> -0.00000000000162003744
A491: 01/07/2005 | B491: 0.996 | C491: 0.996 | D491: 1.28427230718069 | E491: 1.2842723072 | F491: of:=[.B491]-[.C491] -> 0 | G491: of:=[.D491]-[.E491] -> -0.00000000001930988702
A492: 01/08/2005 | B492: 0.9921 | C492: 0.9921 | D492: 1.28943002728985 | E492: 1.2894300273 | F492: of:=[.B492]-[.C492] -> 0 | G492: of:=[.D492]-[.E492] -> -0.00000000001014988094
A493: 01/09/2005 | B493: 0.9987 | C493: 0.9987 | D493: 1.29969763863507 | E493: 1.2996976386 | F493: of:=[.B493]-[.C493] -> 0 | G493: of:=[.D493]-[.E493] -> 0.00000000003506994695
A494: 01/10/2005 | B494: 1.0063 | C494: 1.0063 | D494: 1.30138944491346 | E494: 1.3013894449 | F494: of:=[.B494]-[.C494] -> 0 | G494: of:=[.D494]-[.E494] -> 0.00000000001345989986
A495: 01/11/2005 | B495: 1.0033 | C495: 1.0033 | D495: 1.29324202018629 | E495: 1.2932420202 | F495: of:=[.B495]-[.C495] -> 0 | G495: of:=[.D495]-[.E495] -> -0.00000000001370992209
A496: 01/12/2005 | B496: 1.0007 | C496: 1.0007 | D496: 1.2889883586029 | E496: 1.2889883586 | F496: of:=[.B496]-[.C496] -> 0 | G496: of:=[.D496]-[.E496] -> 0.00000000000290012458
A497: 01/01/2006 | B497: 1.0072 | C497: 1.0072 | D497: 1.28808669791436 | E497: 1.2880866979 | F497: of:=[.B497]-[.C497] -> 0 | G497: of:=[.D497]-[.E497] -> 0.00000000001435984665
A498: 01/02/2006 | B498: 0.9994 | C498: 0.9994 | D498: 1.27887877076485 | E498: 1.2788787708 | F498: of:=[.B498]-[.C498] -> 0 | G498: of:=[.D498]-[.E498] -> -0.00000000003515010505
A499: 01/03/2006 | B499: 0.9955 | C499: 0.9955 | D499: 1.27964655870007 | E499: 1.2796465587 | F499: of:=[.B499]-[.C499] -> 0 | G499: of:=[.D499]-[.E499] -> 0.00000000000006994405
A500: 01/04/2006 | B500: 1.0002 | C500: 1.0002 | D500: 1.28543099819193 | E500: 1.2854309982 | F500: of:=[.B500]-[.C500] -> 0 | G500: of:=[.D500]-[.E500] -> -0.00000000000806998912
A501: 01/05/2006 | B501: 1.0038 | C501: 1.0038 | D501: 1.28517396339925 | E501: 1.2851739634 | F501: of:=[.B501]-[.C501] -> 0 | G501: of:=[.D501]-[.E501] -> -0.00000000000074984463
A502: 01/06/2006 | B502: 1.0067 | C502: 1.0067 | D502: 1.28030878999726 | E502: 1.28030879 | F502: of:=[.B502]-[.C502] -> 0 | G502: of:=[.D502]-[.E502] -> -0.00000000000274003042
A503: 01/07/2006 | B503: 1.0017 | C503: 1.0017 | D503: 1.27178781165914 | E503: 1.2717878117 | F503: of:=[.B503]-[.C503] -> 0 | G503: of:=[.D503]-[.E503] -> -0.00000000004086020411
A504: 01/08/2006 | B504: 1.0041 | C504: 1.0041 | D504: 1.26962944160841 | E504: 1.2696294416 | F504: of:=[.B504]-[.C504] -> 0 | G504: of:=[.D504]-[.E504] -> 0.00000000000840993941
A505: 01/09/2006 | B505: 1.0016 | C505: 1.0016 | D505: 1.2644452162219 | E505: 1.2644452162 | F505: of:=[.B505]-[.C505] -> 0 | G505: of:=[.D505]-[.E505] -> 0.00000000002190003734
A506: 01/10/2006 | B506: 1.0043 | C506: 1.0043 | D506: 1.2624253356848 | E506: 1.2624253357 | F506: of:=[.B506]-[.C506] -> 0 | G506: of:=[.D506]-[.E506] -> -0.00000000001519984139
A507: 01/11/2006 | B507: 1.0042 | C507: 1.0042 | D507: 1.25702014904391 | E507: 1.257020149 | F507: of:=[.B507]-[.C507] -> 0 | G507: of:=[.D507]-[.E507] -> 0.00000000004390998676
A508: 01/12/2006 | B508: 1.0062 | C508: 1.0062 | D508: 1.25176274551276 | E508: 1.2517627455 | F508: of:=[.B508]-[.C508] -> 0 | G508: of:=[.D508]-[.E508] -> 0.00000000001276001527
A509: 01/01/2007 | B509: 1.0049 | C509: 1.0049 | D509: 1.24404963775866 | E509: 1.2440496378 | F509: of:=[.B509]-[.C509] -> 0 | G509: of:=[.D509]-[.E509] -> -0.0000000000413400425
A510: 01/02/2007 | B510: 1.0042 | C510: 1.0042 | D510: 1.23798351851792 | E510: 1.2379835185 | F510: of:=[.B510]-[.C510] -> 0 | G510: of:=[.D510]-[.E510] -> 0.0000000000179198878
A511: 01/03/2007 | B511: 1.0044 | C511: 1.0044 | D511: 1.2328057344333 | E511: 1.2328057344 | F511: of:=[.B511]-[.C511] -> 0 | G511: of:=[.D511]-[.E511] -> 0.0000000000333000294
A512: 01/04/2007 | B512: 1.0026 | C512: 1.0026 | D512: 1.22740515176553 | E512: 1.2274051518 | F512: of:=[.B512]-[.C512] -> 0 | G512: of:=[.D512]-[.E512] -> -0.00000000003446998242
A513: 01/05/2007 | B513: 1.0026 | C513: 1.0026 | D513: 1.22422217411284 | E513: 1.2242221741 | F513: of:=[.B513]-[.C513] -> 0 | G513: of:=[.D513]-[.E513] -> 0.00000000001284017337
A514: 01/06/2007 | B514: 1.0031 | C514: 1.0031 | D514: 1.22104745074091 | E514: 1.2210474507 | F514: of:=[.B514]-[.C514] -> 0 | G514: of:=[.D514]-[.E514] -> 0.0000000000409099421
A515: 01/07/2007 | B515: 1.0032 | C515: 1.0032 | D515: 1.21727390164581 | E515: 1.2172739016 | F515: of:=[.B515]-[.C515] -> 0 | G515: of:=[.D515]-[.E515] -> 0.00000000004581002244
A516: 01/08/2007 | B516: 1.0059 | C516: 1.0059 | D516: 1.2133910502849 | E516: 1.2133910503 | F516: of:=[.B516]-[.C516] -> 0 | G516: of:=[.D516]-[.E516] -> -0.00000000001510014336
A517: 01/09/2007 | B517: 1.0025 | C517: 1.0025 | D517: 1.20627403348732 | E517: 1.2062740335 | F517: of:=[.B517]-[.C517] -> 0 | G517: of:=[.D517]-[.E517] -> -0.00000000001267985716
A518: 01/10/2007 | B518: 1.003 | C518: 1.003 | D518: 1.20326586881528 | E518: 1.2032658688 | F518: of:=[.B518]-[.C518] -> 0 | G518: of:=[.D518]-[.E518] -> 0.00000000001527999949
A519: 01/11/2007 | B519: 1.0043 | C519: 1.0043 | D519: 1.19966686821065 | E519: 1.1996668682 | F519: of:=[.B519]-[.C519] -> 0 | G519: of:=[.D519]-[.E519] -> 0.00000000001064992539
A520: 01/12/2007 | B520: 1.0097 | C520: 1.0097 | D520: 1.19453038754421 | E520: 1.1945303875 | F520: of:=[.B520]-[.C520] -> 0 | G520: of:=[.D520]-[.E520] -> 0.00000000004420996902
A521: 01/01/2008 | B521: 1.0069 | C521: 1.0069 | D521: 1.18305475640706 | E521: 1.1830547564 | F521: of:=[.B521]-[.C521] -> 0 | G521: of:=[.D521]-[.E521] -> 0.00000000000705990821
A522: 01/02/2008 | B522: 1.0048 | C522: 1.0048 | D522: 1.17494761784394 | E522: 1.1749476178 | F522: of:=[.B522]-[.C522] -> 0 | G522: of:=[.D522]-[.E522] -> 0.00000000004393996278
A523: 01/03/2008 | B523: 1.0051 | C523: 1.0051 | D523: 1.16933481075233 | E523: 1.1693348108 | F523: of:=[.B523]-[.C523] -> 0 | G523: of:=[.D523]-[.E523] -> -0.00000000004766986805
A524: 01/04/2008 | B524: 1.0064 | C524: 1.0064 | D524: 1.16340146328955 | E524: 1.1634014633 | F524: of:=[.B524]-[.C524] -> 0 | G524: of:=[.D524]-[.E524] -> -0.00000000001045008524
A525: 01/05/2008 | B525: 1.0096 | C525: 1.0096 | D525: 1.15600304380917 | E525: 1.1560030438 | F525: of:=[.B525]-[.C525] -> 0 | G525: of:=[.D525]-[.E525] -> 0.00000000000916999809
A526: 01/06/2008 | B526: 1.0091 | C526: 1.0091 | D526: 1.14501093879672 | E526: 1.1450109388 | F526: of:=[.B526]-[.C526] -> 0 | G526: of:=[.D526]-[.E526] -> -0.0000000000032800429
A527: 01/07/2008 | B527: 1.0058 | C527: 1.0058 | D527: 1.13468530254357 | E527: 1.1346853025 | F527: of:=[.B527]-[.C527] -> 0 | G527: of:=[.D527]-[.E527] -> 0.00000000004356981442
A528: 01/08/2008 | B528: 1.0021 | C528: 1.0021 | D528: 1.12814207848834 | E528: 1.1281420785 | F528: of:=[.B528]-[.C528] -> 0 | G528: of:=[.D528]-[.E528] -> -0.00000000001166000629
A529: 01/09/2008 | B529: 1.0015 | C529: 1.0015 | D529: 1.12577794480425 | E529: 1.1257779448 | F529: of:=[.B529]-[.C529] -> 0 | G529: of:=[.D529]-[.E529] -> 0.00000000000424993374
A530: 01/10/2008 | B530: 1.005 | C530: 1.005 | D530: 1.12409180709361 | E530: 1.1240918071 | F530: of:=[.B530]-[.C530] -> 0 | G530: of:=[.D530]-[.E530] -> -0.00000000000638999964
A531: 01/11/2008 | B531: 1.0038 | C531: 1.0038 | D531: 1.11849931054091 | E531: 1.1184993105 | F531: of:=[.B531]-[.C531] -> 0 | G531: of:=[.D531]-[.E531] -> 0.0000000000409099421
A532: 01/12/2008 | B532: 1.0029 | C532: 1.0029 | D532: 1.11426510314894 | E532: 1.1142651031 | F532: of:=[.B532]-[.C532] -> 0 | G532: of:=[.D532]-[.E532] -> 0.00000000004893996319
A533: 01/01/2009 | B533: 1.0064 | C533: 1.0064 | D533: 1.1110430782221 | E533: 1.1110430782 | F533: of:=[.B533]-[.C533] -> 0 | G533: of:=[.D533]-[.E533] -> 0.00000000002209987748
A534: 01/02/2009 | B534: 1.0031 | C534: 1.0031 | D534: 1.10397762144485 | E534: 1.1039776214 | F534: of:=[.B534]-[.C534] -> 0 | G534: of:=[.D534]-[.E534] -> 0.00000000004484990157
A535: 01/03/2009 | B535: 1.002 | C535: 1.002 | D535: 1.10056586725636 | E535: 1.1005658673 | F535: of:=[.B535]-[.C535] -> 0 | G535: of:=[.D535]-[.E535] -> -0.00000000004363998052
A536: 01/04/2009 | B536: 1.0055 | C536: 1.0055 | D536: 1.09836912899836 | E536: 1.098369129 | F536: of:=[.B536]-[.C536] -> 0 | G536: of:=[.D536]-[.E536] -> -0.00000000000164002145
A537: 01/05/2009 | B537: 1.006 | C537: 1.006 | D537: 1.09236114271344 | E537: 1.0923611427 | F537: of:=[.B537]-[.C537] -> 0 | G537: of:=[.D537]-[.E537] -> 0.00000000001344013789
A538: 01/06/2009 | B538: 1.0042 | C538: 1.0042 | D538: 1.08584606631555 | E538: 1.0858460663 | F538: of:=[.B538]-[.C538] -> 0 | G538: of:=[.D538]-[.E538] -> 0.00000000001555000573
A539: 01/07/2009 | B539: 1.001051 | C539: 1.001051 | D539: 1.08130458704994 | E539: 1.081304587 | F539: of:=[.B539]-[.C539] -> 0 | G539: of:=[.D539]-[.E539] -> 0.00000000004994005209
A540: 01/08/2009 | B540: 1.000197 | C540: 1.000197 | D540: 1.08016932908507 | E540: 1.0801693291 | F540: of:=[.B540]-[.C540] -> 0 | G540: of:=[.D540]-[.E540] -> -0.00000000001493005719
A541: 01/09/2009 | B541: 1 | C541: 1 | D541: 1.07995657763928 | E541: 1.0799565776 | F541: of:=[.B541]-[.C541] -> 0 | G541: of:=[.D541]-[.E541] -> 0.0000000000392801347
A542: 01/10/2009 | B542: 1 | C542: 1 | D542: 1.07995657763928 | E542: 1.0799565776 | F542: of:=[.B542]-[.C542] -> 0 | G542: of:=[.D542]-[.E542] -> 0.0000000000392801347
A543: 01/11/2009 | B543: 1 | C543: 1 | D543: 1.07995657763928 | E543: 1.0799565776 | F543: of:=[.B543]-[.C543] -> 0 | G543: of:=[.D543]-[.E543] -> 0.0000000000392801347
A544: 01/12/2009 | B544: 1.000533 | C544: 1.000533 | D544: 1.07995657763928 | E544: 1.0799565776 | F544: of:=[.B544]-[.C544] -> 0 | G544: of:=[.D544]-[.E544] -> 0.0000000000392801347
A545: 01/01/2010 | B545: 1 | C545: 1 | D545: 1.07938126742374 | E545: 1.0793812674 | F545: of:=[.B545]-[.C545] -> 0 | G545: of:=[.D545]-[.E545] -> 0.00000000002373989894
A546: 01/02/2010 | B546: 1 | C546: 1 | D546: 1.07938126742374 | E546: 1.0793812674 | F546: of:=[.B546]-[.C546] -> 0 | G546: of:=[.D546]-[.E546] -> 0.00000000002373989894
A547: 01/03/2010 | B547: 1.000792 | C547: 1.000792 | D547: 1.07938126742374 | E547: 1.0793812674 | F547: of:=[.B547]-[.C547] -> 0 | G547: of:=[.D547]-[.E547] -> 0.00000000002373989894
A548: 01/04/2010 | B548: 1 | C548: 1 | D548: 1.07852707398115 | E548: 1.078527074 | F548: of:=[.B548]-[.C548] -> 0 | G548: of:=[.D548]-[.E548] -> -0.0000000000188498106
A549: 01/05/2010 | B549: 1.00051 | C549: 1.00051 | D549: 1.07852707398115 | E549: 1.078527074 | F549: of:=[.B549]-[.C549] -> 0 | G549: of:=[.D549]-[.E549] -> -0.0000000000188498106
A550: 01/06/2010 | B550: 1.000589 | C550: 1.000589 | D550: 1.07797730555532 | E550: 1.0779773056 | F550: of:=[.B550]-[.C550] -> 0 | G550: of:=[.D550]-[.E550] -> -0.00000000004468003745
A551: 01/07/2010 | B551: 1.001151 | C551: 1.001151 | D551: 1.07734275067517 | E551: 1.0773427507 | F551: of:=[.B551]-[.C551] -> 0 | G551: of:=[.D551]-[.E551] -> -0.0000000000248299159
A552: 01/08/2010 | B552: 1.000909 | C552: 1.000909 | D552: 1.076104154793 | E552: 1.0761041548 | F552: of:=[.B552]-[.C552] -> 0 | G552: of:=[.D552]-[.E552] -> -0.00000000000700017821
A553: 01/09/2010 | B553: 1.000702 | C553: 1.000702 | D553: 1.07512686447319 | E553: 1.0751268645 | F553: of:=[.B553]-[.C553] -> 0 | G553: of:=[.D553]-[.E553] -> -0.00000000002681010969
A554: 01/10/2010 | B554: 1.000472 | C554: 1.000472 | D554: 1.07437265486947 | E554: 1.0743726549 | F554: of:=[.B554]-[.C554] -> 0 | G554: of:=[.D554]-[.E554] -> -0.00000000003052980091
A555: 01/11/2010 | B555: 1.000336 | C555: 1.000336 | D555: 1.07386579021649 | E555: 1.0738657902 | F555: of:=[.B555]-[.C555] -> 0 | G555: of:=[.D555]-[.E555] -> 0.00000000001649014258
A556: 01/12/2010 | B556: 1.001406 | C556: 1.001406 | D556: 1.07350509250541 | E556: 1.0735050925 | F556: of:=[.B556]-[.C556] -> 0 | G556: of:=[.D556]-[.E556] -> 0.00000000000540989475
A557: 01/01/2011 | B557: 1.000715 | C557: 1.000715 | D557: 1.07199786350932 | E557: 1.0719978635 | F557: of:=[.B557]-[.C557] -> 0 | G557: of:=[.D557]-[.E557] -> 0.0000000000093198782
A558: 01/02/2011 | B558: 1.000524 | C558: 1.000524 | D558: 1.07123193267746 | E558: 1.0712319327 | F558: of:=[.B558]-[.C558] -> 0 | G558: of:=[.D558]-[.E558] -> -0.00000000002253996989
A559: 01/03/2011 | B559: 1.001212 | C559: 1.001212 | D559: 1.07067090112527 | E559: 1.0706709011 | F559: of:=[.B559]-[.C559] -> 0 | G559: of:=[.D559]-[.E559] -> 0.00000000002527000831
A560: 01/04/2011 | B560: 1.000369 | C560: 1.000369 | D560: 1.06937481884483 | E560: 1.0693748188 | F560: of:=[.B560]-[.C560] -> 0 | G560: of:=[.D560]-[.E560] -> 0.00000000004482991756
A561: 01/05/2011 | B561: 1.00157 | C561: 1.00157 | D561: 1.06898036509011 | E561: 1.0689803651 | F561: of:=[.B561]-[.C561] -> 0 | G561: of:=[.D561]-[.E561] -> -0.00000000000989008875
A562: 01/06/2011 | B562: 1.001114 | C562: 1.001114 | D562: 1.06730469671627 | E562: 1.0673046967 | F562: of:=[.B562]-[.C562] -> 0 | G562: of:=[.D562]-[.E562] -> 0.00000000001627009638
A563: 01/07/2011 | B563: 1.001229 | C563: 1.001229 | D563: 1.06611704233111 | E563: 1.0661170423 | F563: of:=[.B563]-[.C563] -> 0 | G563: of:=[.D563]-[.E563] -> 0.00000000003111000346
A564: 01/08/2011 | B564: 1.002076 | C564: 1.002076 | D564: 1.06480839281634 | E564: 1.0648083928 | F564: of:=[.B564]-[.C564] -> 0 | G564: of:=[.D564]-[.E564] -> 0.00000000001634004043
A565: 01/09/2011 | B565: 1.001003 | C565: 1.001003 | D565: 1.0626024301713 | E565: 1.0626024302 | F565: of:=[.B565]-[.C565] -> 0 | G565: of:=[.D565]-[.E565] -> -0.00000000002869993132
A566: 01/10/2011 | B566: 1.00062 | C566: 1.00062 | D566: 1.06153770785033 | E566: 1.0615377079 | F566: of:=[.B566]-[.C566] -> 0 | G566: of:=[.D566]-[.E566] -> -0.00000000004966982381
A567: 01/11/2011 | B567: 1.000645 | C567: 1.000645 | D567: 1.06087996227372 | E567: 1.0608799623 | F567: of:=[.B567]-[.C567] -> 0 | G567: of:=[.D567]-[.E567] -> -0.00000000002628008922
A568: 01/12/2011 | B568: 1.000937 | C568: 1.000937 | D568: 1.06019613576615 | E568: 1.0601961358 | F568: of:=[.B568]-[.C568] -> 0 | G568: of:=[.D568]-[.E568] -> -0.00000000003385003389
A569: 01/01/2012 | B569: 1.000864 | C569: 1.000864 | D569: 1.05920366193492 | E569: 1.0592036619 | F569: of:=[.B569]-[.C569] -> 0 | G569: of:=[.D569]-[.E569] -> 0.00000000003492006684
A570: 01/02/2012 | B570: 1 | C570: 1 | D570: 1.05828929997974 | E570: 1.0582893 | F570: of:=[.B570]-[.C570] -> 0 | G570: of:=[.D570]-[.E570] -> -0.00000000002026001589
A571: 01/03/2012 | B571: 1.001068 | C571: 1.001068 | D571: 1.05828929997974 | E571: 1.0582893 | F571: of:=[.B571]-[.C571] -> 0 | G571: of:=[.D571]-[.E571] -> -0.00000000002026001589
A572: 01/04/2012 | B572: 1.000227 | C572: 1.000227 | D572: 1.05716025282972 | E572: 1.0571602528 | F572: of:=[.B572]-[.C572] -> 0 | G572: of:=[.D572]-[.E572] -> 0.00000000002972000424
A573: 01/05/2012 | B573: 1.000468 | C573: 1.000468 | D573: 1.05692033191438 | E573: 1.0569203319 | F573: of:=[.B573]-[.C573] -> 0 | G573: of:=[.D573]-[.E573] -> 0.0000000000143800527
A574: 01/06/2012 | B574: 1 | C574: 1 | D574: 1.05642592458168 | E574: 1.0564259246 | F574: of:=[.B574]-[.C574] -> 0 | G574: of:=[.D574]-[.E574] -> -0.00000000001832001217
A575: 01/07/2012 | B575: 1.000144 | C575: 1.000144 | D575: 1.05642592458168 | E575: 1.0564259246 | F575: of:=[.B575]-[.C575] -> 0 | G575: of:=[.D575]-[.E575] -> -0.00000000001832001217
A576: 01/08/2012 | B576: 1.000123 | C576: 1.000123 | D576: 1.05627382115143 | E576: 1.0562738212 | F576: of:=[.B576]-[.C576] -> 0 | G576: of:=[.D576]-[.E576] -> -0.00000000004857003688
A577: 01/09/2012 | B577: 1 | C577: 1 | D577: 1.05614391544983 | E577: 1.0561439154 | F577: of:=[.B577]-[.C577] -> 0 | G577: of:=[.D577]-[.E577] -> 0.00000000004982991797
A578: 01/10/2012 | B578: 1 | C578: 1 | D578: 1.05614391544983 | E578: 1.0561439154 | F578: of:=[.B578]-[.C578] -> 0 | G578: of:=[.D578]-[.E578] -> 0.00000000004982991797
A579: 01/11/2012 | B579: 1 | C579: 1 | D579: 1.05614391544983 | E579: 1.0561439154 | F579: of:=[.B579]-[.C579] -> 0 | G579: of:=[.D579]-[.E579] -> 0.00000000004982991797
A580: 01/12/2012 | B580: 1 | C580: 1 | D580: 1.05614391544983 | E580: 1.0561439154 | F580: of:=[.B580]-[.C580] -> 0 | G580: of:=[.D580]-[.E580] -> 0.00000000004982991797
A581: 01/01/2013 | B581: 1 | C581: 1 | D581: 1.05614391544983 | E581: 1.0561439154 | F581: of:=[.B581]-[.C581] -> 0 | G581: of:=[.D581]-[.E581] -> 0.00000000004982991797
A582: 01/02/2013 | B582: 1 | C582: 1 | D582: 1.05614391544983 | E582: 1.0561439154 | F582: of:=[.B582]-[.C582] -> 0 | G582: of:=[.D582]-[.E582] -> 0.00000000004982991797
A583: 01/03/2013 | B583: 1 | C583: 1 | D583: 1.05614391544983 | E583: 1.0561439154 | F583: of:=[.B583]-[.C583] -> 0 | G583: of:=[.D583]-[.E583] -> 0.00000000004982991797
A584: 01/04/2013 | B584: 1 | C584: 1 | D584: 1.05614391544983 | E584: 1.0561439154 | F584: of:=[.B584]-[.C584] -> 0 | G584: of:=[.D584]-[.E584] -> 0.00000000004982991797
A585: 01/05/2013 | B585: 1 | C585: 1 | D585: 1.05614391544983 | E585: 1.0561439154 | F585: of:=[.B585]-[.C585] -> 0 | G585: of:=[.D585]-[.E585] -> 0.00000000004982991797
A586: 01/06/2013 | B586: 1 | C586: 1 | D586: 1.05614391544983 | E586: 1.0561439154 | F586: of:=[.B586]-[.C586] -> 0 | G586: of:=[.D586]-[.E586] -> 0.00000000004982991797
A587: 01/07/2013 | B587: 1.000209 | C587: 1.000209 | D587: 1.05614391544983 | E587: 1.0561439154 | F587: of:=[.B587]-[.C587] -> 0 | G587: of:=[.D587]-[.E587] -> 0.00000000004982991797
A588: 01/08/2013 | B588: 1 | C588: 1 | D588: 1.05592322749528 | E588: 1.0559232275 | F588: of:=[.B588]-[.C588] -> 0 | G588: of:=[.D588]-[.E588] -> -0.00000000000472000217
A589: 01/09/2013 | B589: 1.000079 | C589: 1.000079 | D589: 1.05592322749528 | E589: 1.0559232275 | F589: of:=[.B589]-[.C589] -> 0 | G589: of:=[.D589]-[.E589] -> -0.00000000000472000217
A590: 01/10/2013 | B590: 1.00092 | C590: 1.00092 | D590: 1.0558398161498 | E590: 1.0558398161 | F590: of:=[.B590]-[.C590] -> 0 | G590: of:=[.D590]-[.E590] -> 0.00000000004979994195
A591: 01/11/2013 | B591: 1.000207 | C591: 1.000207 | D591: 1.05486933636035 | E591: 1.0548693364 | F591: of:=[.B591]-[.C591] -> 0 | G591: of:=[.D591]-[.E591] -> -0.00000000003964983897
A592: 01/12/2013 | B592: 1.000494 | C592: 1.000494 | D592: 1.05465102359847 | E592: 1.0546510236 | F592: of:=[.B592]-[.C592] -> 0 | G592: of:=[.D592]-[.E592] -> -0.00000000000152988733
A593: 01/01/2014 | B593: 1.001126 | C593: 1.001126 | D593: 1.05413028323855 | E593: 1.0541302832 | F593: of:=[.B593]-[.C593] -> 0 | G593: of:=[.D593]-[.E593] -> 0.00000000003855005204
A594: 01/02/2014 | B594: 1.000537 | C594: 1.000537 | D594: 1.0529446675429 | E594: 1.0529446675 | F594: of:=[.B594]-[.C594] -> 0 | G594: of:=[.D594]-[.E594] -> 0.00000000004289990585
A595: 01/03/2014 | B595: 1.000266 | C595: 1.000266 | D595: 1.05237953973006 | E595: 1.0523795397 | F595: of:=[.B595]-[.C595] -> 0 | G595: of:=[.D595]-[.E595] -> 0.00000000003005995453
A596: 01/04/2014 | B596: 1.000459 | C596: 1.000459 | D596: 1.05209968121486 | E596: 1.0520996812 | F596: of:=[.B596]-[.C596] -> 0 | G596: of:=[.D596]-[.E596] -> 0.0000000000148598911
A597: 01/05/2014 | B597: 1.000604 | C597: 1.000604 | D597: 1.0516169890169 | E597: 1.051616989 | F597: of:=[.B597]-[.C597] -> 0 | G597: of:=[.D597]-[.E597] -> 0.00000000001690003693
A598: 01/06/2014 | B598: 1.000465 | C598: 1.000465 | D598: 1.05098219577065 | E598: 1.0509821958 | F598: of:=[.B598]-[.C598] -> 0 | G598: of:=[.D598]-[.E598] -> -0.00000000002935007792
A599: 01/07/2014 | B599: 1.001054 | C599: 1.001054 | D599: 1.05049371619262 | E599: 1.0504937162 | F599: of:=[.B599]-[.C599] -> 0 | G599: of:=[.D599]-[.E599] -> -0.00000000000738009653
A600: 01/08/2014 | B600: 1.000602 | C600: 1.000602 | D600: 1.0493876615973 | E600: 1.0493876616 | F600: of:=[.B600]-[.C600] -> 0 | G600: of:=[.D600]-[.E600] -> -0.0000000000027000624
A601: 01/09/2014 | B601: 1.000873 | C601: 1.000873 | D601: 1.0487563102985 | E601: 1.0487563103 | F601: of:=[.B601]-[.C601] -> 0 | G601: of:=[.D601]-[.E601] -> -0.00000000000149991131
A602: 01/10/2014 | B602: 1.001038 | C602: 1.001038 | D602: 1.04784154463004 | E602: 1.0478415446 | F602: of:=[.B602]-[.C602] -> 0 | G602: of:=[.D602]-[.E602] -> 0.00000000003003997051
A603: 01/11/2014 | B603: 1.000483 | C603: 1.000483 | D603: 1.04675501292662 | E603: 1.0467550129 | F603: of:=[.B603]-[.C603] -> 0 | G603: of:=[.D603]-[.E603] -> 0.00000000002662003951
A604: 01/12/2014 | B604: 1.001053 | C604: 1.001053 | D604: 1.04624967433392 | E604: 1.0462496743 | F604: of:=[.B604]-[.C604] -> 0 | G604: of:=[.D604]-[.E604] -> 0.00000000003391997794
A605: 01/01/2015 | B605: 1.000878 | C605: 1.000878 | D605: 1.04514913229761 | E605: 1.0451491323 | F605: of:=[.B605]-[.C605] -> 0 | G605: of:=[.D605]-[.E605] -> -0.00000000000238986608
A606: 01/02/2015 | B606: 1.000168 | C606: 1.000168 | D606: 1.04423229634142 | E606: 1.0442322963 | F606: of:=[.B606]-[.C606] -> 0 | G606: of:=[.D606]-[.E606] -> 0.00000000004141997856
A607: 01/03/2015 | B607: 1.001296 | C607: 1.001296 | D607: 1.0440568947831 | E607: 1.0440568948 | F607: of:=[.B607]-[.C607] -> 0 | G607: of:=[.D607]-[.E607] -> -0.00000000001690003693
A608: 01/04/2015 | B608: 1.001074 | C608: 1.001074 | D608: 1.04270554839238 | E608: 1.0427055484 | F608: of:=[.B608]-[.C608] -> 0 | G608: of:=[.D608]-[.E608] -> -0.00000000000762012675
A609: 01/05/2015 | B609: 1.001153 | C609: 1.001153 | D609: 1.04158688407888 | E609: 1.0415868841 | F609: of:=[.B609]-[.C609] -> 0 | G609: of:=[.D609]-[.E609] -> -0.00000000002111999464
A610: 01/06/2015 | B610: 1.001813 | C610: 1.001813 | D610: 1.0403873175018 | E610: 1.0403873175 | F610: of:=[.B610]-[.C610] -> 0 | G610: of:=[.D610]-[.E610] -> 0.00000000000179989357
A611: 01/07/2015 | B611: 1.002305 | C611: 1.002305 | D611: 1.0385045088273 | E611: 1.0385045088 | F611: of:=[.B611]-[.C611] -> 0 | G611: of:=[.D611]-[.E611] -> 0.00000000002729994009
A612: 01/08/2015 | B612: 1.001867 | C612: 1.001867 | D612: 1.03611626084605 | E612: 1.0361162608 | F612: of:=[.B612]-[.C612] -> 0 | G612: of:=[.D612]-[.E612] -> 0.00000000004604983062
A613: 01/09/2015 | B613: 1.00192 | C613: 1.00192 | D613: 1.03418543663585 | E613: 1.0341854366 | F613: of:=[.B613]-[.C613] -> 0 | G613: of:=[.D613]-[.E613] -> 0.00000000003584998964
A614: 01/10/2015 | B614: 1.00179 | C614: 1.00179 | D614: 1.03220360571288 | E614: 1.0322036057 | F614: of:=[.B614]-[.C614] -> 0 | G614: of:=[.D614]-[.E614] -> 0.0000000000128801414
A615: 01/11/2015 | B615: 1.001297 | C615: 1.001297 | D615: 1.03035926263277 | E615: 1.0303592626 | F615: of:=[.B615]-[.C615] -> 0 | G615: of:=[.D615]-[.E615] -> 0.00000000003277000893
A616: 01/12/2015 | B616: 1.00225 | C616: 1.00225 | D616: 1.02902461770361 | E616: 1.0290246177 | F616: of:=[.B616]-[.C616] -> 0 | G616: of:=[.D616]-[.E616] -> 0.00000000000361000119
A617: 01/01/2016 | B617: 1.00132 | C617: 1.00132 | D617: 1.02671451005598 | E617: 1.0267145101 | F617: of:=[.B617]-[.C617] -> 0 | G617: of:=[.D617]-[.E617] -> -0.00000000004401989884
A618: 01/02/2016 | B618: 1.000957 | C618: 1.000957 | D618: 1.02536103349177 | E618: 1.0253610335 | F618: of:=[.B618]-[.C618] -> 0 | G618: of:=[.D618]-[.E618] -> -0.00000000000823008328
A619: 01/03/2016 | B619: 1.002168 | C619: 1.002168 | D619: 1.02438070116076 | E619: 1.0243807012 | F619: of:=[.B619]-[.C619] -> 0 | G619: of:=[.D619]-[.E619] -> -0.00000000003923994463
A620: 01/04/2016 | B620: 1.001304 | C620: 1.001304 | D620: 1.02216464820345 | E620: 1.0221646482 | F620: of:=[.B620]-[.C620] -> 0 | G620: of:=[.D620]-[.E620] -> 0.00000000000345012907
A621: 01/05/2016 | B621: 1.001533 | C621: 1.001533 | D621: 1.02083348134378 | E621: 1.0208334813 | F621: of:=[.B621]-[.C621] -> 0 | G621: of:=[.D621]-[.E621] -> 0.00000000004378009066
A622: 01/06/2016 | B622: 1.002043 | C622: 1.002043 | D622: 1.0192709389943 | E622: 1.019270939 | F622: of:=[.B622]-[.C622] -> 0 | G622: of:=[.D622]-[.E622] -> -0.00000000000570010705
A623: 01/07/2016 | B623: 1.001621 | C623: 1.001621 | D623: 1.01719281407514 | E623: 1.0171928141 | F623: of:=[.B623]-[.C623] -> 0 | G623: of:=[.D623]-[.E623] -> -0.00000000002485989192
A624: 01/08/2016 | B624: 1.002545 | C624: 1.002545 | D624: 1.01554661301544 | E624: 1.015546613 | F624: of:=[.B624]-[.C624] -> 0 | G624: of:=[.D624]-[.E624] -> 0.00000000001544009365
A625: 01/09/2016 | B625: 1.001575 | C625: 1.001575 | D625: 1.01296860790831 | E625: 1.0129686079 | F625: of:=[.B625]-[.C625] -> 0 | G625: of:=[.D625]-[.E625] -> 0.00000000000831001934
A626: 01/10/2016 | B626: 1.001601 | C626: 1.001601 | D626: 1.01137569119468 | E626: 1.0113756912 | F626: of:=[.B626]-[.C626] -> 0 | G626: of:=[.D626]-[.E626] -> -0.00000000000531996669
A627: 01/11/2016 | B627: 1.001428 | C627: 1.001428 | D627: 1.00975906692853 | E627: 1.0097590669 | F627: of:=[.B627]-[.C627] -> 0 | G627: of:=[.D627]-[.E627] -> 0.00000000002852984515
A628: 01/12/2016 | B628: 1.001849 | C628: 1.001849 | D628: 1.00831918712931 | E628: 1.0083191871 | F628: of:=[.B628]-[.C628] -> 0 | G628: of:=[.D628]-[.E628] -> 0.00000000002931010989
A629: 01/01/2017 | B629: 1.0017 | C629: 1.0017 | D629: 1.00645824583277 | E629: 1.0064582458 | F629: of:=[.B629]-[.C629] -> 0 | G629: of:=[.D629]-[.E629] -> 0.00000000003277000893
A630: 01/02/2017 | B630: 1.000302 | C630: 1.000302 | D630: 1.00475017054285 | E630: 1.0047501705 | F630: of:=[.B630]-[.C630] -> 0 | G630: of:=[.D630]-[.E630] -> 0.00000000004285016786
A631: 01/03/2017 | B631: 1.001519 | C631: 1.001519 | D631: 1.00444682760091 | E631: 1.0044468276 | F631: of:=[.B631]-[.C631] -> 0 | G631: of:=[.D631]-[.E631] -> 0.00000000000090993879
A632: 01/04/2017 | B632: 1 | C632: 1 | D632: 1.00292338697609 | E632: 1.002923387 | F632: of:=[.B632]-[.C632] -> 0 | G632: of:=[.D632]-[.E632] -> -0.0000000000239099851
A633: 01/05/2017 | B633: 1.000764 | C633: 1.000764 | D633: 1.00292338697609 | E633: 1.002923387 | F633: of:=[.B633]-[.C633] -> 0 | G633: of:=[.D633]-[.E633] -> -0.0000000000239099851
A634: 01/06/2017 | B634: 1.000536 | C634: 1.000536 | D634: 1.0021577384639 | E634: 1.0021577385 | F634: of:=[.B634]-[.C634] -> 0 | G634: of:=[.D634]-[.E634] -> -0.00000000003610001187
A635: 01/07/2017 | B635: 1.000623 | C635: 1.000623 | D635: 1.00162086967775 | E635: 1.0016208697 | F635: of:=[.B635]-[.C635] -> 0 | G635: of:=[.D635]-[.E635] -> -0.00000000002224997964
A636: 01/08/2017 | B636: 1.000509 | C636: 1.000509 | D636: 1.000997248392 | E636: 1.0009972484 | F636: of:=[.B636]-[.C636] -> 0 | G636: of:=[.D636]-[.E636] -> -0.00000000000800004507
A637: 01/09/2017 | B637: 1 | C637: 1 | D637: 1.000488 | E637: 1.000488 | F637: of:=[.B637]-[.C637] -> 0 | G637: of:=[.D637]-[.E637] -> 0
A638: 01/10/2017 | B638: 1 | C638: 1 | D638: 1.000488 | E638: 1.000488 | F638: of:=[.B638]-[.C638] -> 0 | G638: of:=[.D638]-[.E638] -> 0
A639: 01/11/2017 | B639: 1 | C639: 1 | D639: 1.000488 | E639: 1.000488 | F639: of:=[.B639]-[.C639] -> 0 | G639: of:=[.D639]-[.E639] -> 0
A640: 01/12/2017 | B640: 1 | C640: 1 | D640: 1.000488 | E640: 1.000488 | F640: of:=[.B640]-[.C640] -> 0 | G640: of:=[.D640]-[.E640] -> 0
A641: 01/01/2018 | B641: 1 | C641: 1 | D641: 1.000488 | E641: 1.000488 | F641: of:=[.B641]-[.C641] -> 0 | G641: of:=[.D641]-[.E641] -> 0
A642: 01/02/2018 | B642: 1 | C642: 1 | D642: 1.000488 | E642: 1.000488 | F642: of:=[.B642]-[.C642] -> 0 | G642: of:=[.D642]-[.E642] -> 0
A643: 01/03/2018 | B643: 1 | C643: 1 | D643: 1.000488 | E643: 1.000488 | F643: of:=[.B643]-[.C643] -> 0 | G643: of:=[.D643]-[.E643] -> 0
A644: 01/04/2018 | B644: 1 | C644: 1 | D644: 1.000488 | E644: 1.000488 | F644: of:=[.B644]-[.C644] -> 0 | G644: of:=[.D644]-[.E644] -> 0
A645: 01/05/2018 | B645: 1 | C645: 1 | D645: 1.000488 | E645: 1.000488 | F645: of:=[.B645]-[.C645] -> 0 | G645: of:=[.D645]-[.E645] -> 0
A646: 01/06/2018 | B646: 1 | C646: 1 | D646: 1.000488 | E646: 1.000488 | F646: of:=[.B646]-[.C646] -> 0 | G646: of:=[.D646]-[.E646] -> 0
A647: 01/07/2018 | B647: 1 | C647: 1 | D647: 1.000488 | E647: 1.000488 | F647: of:=[.B647]-[.C647] -> 0 | G647: of:=[.D647]-[.E647] -> 0
A648: 01/08/2018 | B648: 1 | C648: 1 | D648: 1.000488 | E648: 1.000488 | F648: of:=[.B648]-[.C648] -> 0 | G648: of:=[.D648]-[.E648] -> 0
A649: 01/09/2018 | B649: 1 | C649: 1 | D649: 1.000488 | E649: 1.000488 | F649: of:=[.B649]-[.C649] -> 0 | G649: of:=[.D649]-[.E649] -> 0
A650: 01/10/2018 | B650: 1 | C650: 1 | D650: 1.000488 | E650: 1.000488 | F650: of:=[.B650]-[.C650] -> 0 | G650: of:=[.D650]-[.E650] -> 0
A651: 01/11/2018 | B651: 1 | C651: 1 | D651: 1.000488 | E651: 1.000488 | F651: of:=[.B651]-[.C651] -> 0 | G651: of:=[.D651]-[.E651] -> 0
A652: 01/12/2018 | B652: 1 | C652: 1 | D652: 1.000488 | E652: 1.000488 | F652: of:=[.B652]-[.C652] -> 0 | G652: of:=[.D652]-[.E652] -> 0
A653: 01/01/2019 | B653: 1 | C653: 1 | D653: 1.000488 | E653: 1.000488 | F653: of:=[.B653]-[.C653] -> 0 | G653: of:=[.D653]-[.E653] -> 0
A654: 01/02/2019 | B654: 1 | C654: 1 | D654: 1.000488 | E654: 1.000488 | F654: of:=[.B654]-[.C654] -> 0 | G654: of:=[.D654]-[.E654] -> 0
A655: 01/03/2019 | B655: 1 | C655: 1 | D655: 1.000488 | E655: 1.000488 | F655: of:=[.B655]-[.C655] -> 0 | G655: of:=[.D655]-[.E655] -> 0
A656: 01/04/2019 | B656: 1 | C656: 1 | D656: 1.000488 | E656: 1.000488 | F656: of:=[.B656]-[.C656] -> 0 | G656: of:=[.D656]-[.E656] -> 0
A657: 01/05/2019 | B657: 1 | C657: 1 | D657: 1.000488 | E657: 1.000488 | F657: of:=[.B657]-[.C657] -> 0 | G657: of:=[.D657]-[.E657] -> 0
A658: 01/06/2019 | B658: 1 | C658: 1 | D658: 1.000488 | E658: 1.000488 | F658: of:=[.B658]-[.C658] -> 0 | G658: of:=[.D658]-[.E658] -> 0
A659: 01/07/2019 | B659: 1 | C659: 1 | D659: 1.000488 | E659: 1.000488 | F659: of:=[.B659]-[.C659] -> 0 | G659: of:=[.D659]-[.E659] -> 0
A660: 01/08/2019 | B660: 1 | C660: 1 | D660: 1.000488 | E660: 1.000488 | F660: of:=[.B660]-[.C660] -> 0 | G660: of:=[.D660]-[.E660] -> 0
A661: 01/09/2019 | B661: 1 | C661: 1 | D661: 1.000488 | E661: 1.000488 | F661: of:=[.B661]-[.C661] -> 0 | G661: of:=[.D661]-[.E661] -> 0
A662: 01/10/2019 | B662: 1 | C662: 1 | D662: 1.000488 | E662: 1.000488 | F662: of:=[.B662]-[.C662] -> 0 | G662: of:=[.D662]-[.E662] -> 0
A663: 01/11/2019 | B663: 1 | C663: 1 | D663: 1.000488 | E663: 1.000488 | F663: of:=[.B663]-[.C663] -> 0 | G663: of:=[.D663]-[.E663] -> 0
A664: 01/12/2019 | B664: 1 | C664: 1 | D664: 1.000488 | E664: 1.000488 | F664: of:=[.B664]-[.C664] -> 0 | G664: of:=[.D664]-[.E664] -> 0
A665: 01/01/2020 | B665: 1 | C665: 1 | D665: 1.000488 | E665: 1.000488 | F665: of:=[.B665]-[.C665] -> 0 | G665: of:=[.D665]-[.E665] -> 0
A666: 01/02/2020 | B666: 1 | C666: 1 | D666: 1.000488 | E666: 1.000488 | F666: of:=[.B666]-[.C666] -> 0 | G666: of:=[.D666]-[.E666] -> 0
A667: 01/03/2020 | B667: 1 | C667: 1 | D667: 1.000488 | E667: 1.000488 | F667: of:=[.B667]-[.C667] -> 0 | G667: of:=[.D667]-[.E667] -> 0
A668: 01/04/2020 | B668: 1 | C668: 1 | D668: 1.000488 | E668: 1.000488 | F668: of:=[.B668]-[.C668] -> 0 | G668: of:=[.D668]-[.E668] -> 0
A669: 01/05/2020 | B669: 1 | C669: 1 | D669: 1.000488 | E669: 1.000488 | F669: of:=[.B669]-[.C669] -> 0 | G669: of:=[.D669]-[.E669] -> 0
A670: 01/06/2020 | B670: 1 | C670: 1 | D670: 1.000488 | E670: 1.000488 | F670: of:=[.B670]-[.C670] -> 0 | G670: of:=[.D670]-[.E670] -> 0
A671: 01/07/2020 | B671: 1 | C671: 1 | D671: 1.000488 | E671: 1.000488 | F671: of:=[.B671]-[.C671] -> 0 | G671: of:=[.D671]-[.E671] -> 0
A672: 01/08/2020 | B672: 1 | C672: 1 | D672: 1.000488 | E672: 1.000488 | F672: of:=[.B672]-[.C672] -> 0 | G672: of:=[.D672]-[.E672] -> 0
A673: 01/09/2020 | B673: 1 | C673: 1 | D673: 1.000488 | E673: 1.000488 | F673: of:=[.B673]-[.C673] -> 0 | G673: of:=[.D673]-[.E673] -> 0
A674: 01/10/2020 | B674: 1 | C674: 1 | D674: 1.000488 | E674: 1.000488 | F674: of:=[.B674]-[.C674] -> 0 | G674: of:=[.D674]-[.E674] -> 0
A675: 01/11/2020 | B675: 1 | C675: 1 | D675: 1.000488 | E675: 1.000488 | F675: of:=[.B675]-[.C675] -> 0 | G675: of:=[.D675]-[.E675] -> 0
A676: 01/12/2020 | B676: 1 | C676: 1 | D676: 1.000488 | E676: 1.000488 | F676: of:=[.B676]-[.C676] -> 0 | G676: of:=[.D676]-[.E676] -> 0
A677: 01/01/2021 | B677: 1 | C677: 1 | D677: 1.000488 | E677: 1.000488 | F677: of:=[.B677]-[.C677] -> 0 | G677: of:=[.D677]-[.E677] -> 0
A678: 01/02/2021 | B678: 1 | C678: 1 | D678: 1.000488 | E678: 1.000488 | F678: of:=[.B678]-[.C678] -> 0 | G678: of:=[.D678]-[.E678] -> 0
A679: 01/03/2021 | B679: 1 | C679: 1 | D679: 1.000488 | E679: 1.000488 | F679: of:=[.B679]-[.C679] -> 0 | G679: of:=[.D679]-[.E679] -> 0
A680: 01/04/2021 | B680: 1 | C680: 1 | D680: 1.000488 | E680: 1.000488 | F680: of:=[.B680]-[.C680] -> 0 | G680: of:=[.D680]-[.E680] -> 0
A681: 01/05/2021 | B681: 1 | C681: 1 | D681: 1.000488 | E681: 1.000488 | F681: of:=[.B681]-[.C681] -> 0 | G681: of:=[.D681]-[.E681] -> 0
A682: 01/06/2021 | B682: 1 | C682: 1 | D682: 1.000488 | E682: 1.000488 | F682: of:=[.B682]-[.C682] -> 0 | G682: of:=[.D682]-[.E682] -> 0
A683: 01/07/2021 | B683: 1 | C683: 1 | D683: 1.000488 | E683: 1.000488 | F683: of:=[.B683]-[.C683] -> 0 | G683: of:=[.D683]-[.E683] -> 0
A684: 01/08/2021 | B684: 1 | C684: 1 | D684: 1.000488 | E684: 1.000488 | F684: of:=[.B684]-[.C684] -> 0 | G684: of:=[.D684]-[.E684] -> 0
A685: 01/09/2021 | B685: 1 | C685: 1 | D685: 1.000488 | E685: 1.000488 | F685: of:=[.B685]-[.C685] -> 0 | G685: of:=[.D685]-[.E685] -> 0
A686: 01/10/2021 | B686: 1 | C686: 1 | D686: 1.000488 | E686: 1.000488 | F686: of:=[.B686]-[.C686] -> 0 | G686: of:=[.D686]-[.E686] -> 0